{
 "author": [
  "Dickens, Charles"
 ],
 "title": [
  "A Christmas Carol in Prose; Being a Ghost Story of Christmas"
 ],
 "language": [
  "en"
 ],
 "theme": [
  "Scrooge, Ebenezer (Fictitious character) -- Fiction",
  "Christmas stories",
  "London (England) -- Fiction",
  "Sick children -- Fiction",
  "PR",
  "Poor families -- Fiction",
  "Misers -- Fiction",
  "Ghost stories"
 ],
 "id": "46",
 "genre": [
  "horror",
  "fiction",
  "children"
 ],
 "text": "A CHRISTMAS CAROL\n\nIN PROSE\nBEING\nA Ghost Story of Christmas\n\nby Charles Dickens\n\n\n\nPREFACE\n\nI HAVE endeavoured in this Ghostly little book,\nto raise the Ghost of an Idea, which shall not put my\nreaders out of humour with themselves, with each other,\nwith the season, or with me.  May it haunt their houses\npleasantly, and no one wish to lay it.\n\nTheir faithful Friend and Servant,\n                                   C. D.\nDecember, 1843.\n\n\n\nCONTENTS\n\nStave   I: Marley's Ghost\nStave  II: The First of the Three Spirits\nStave III: The Second of the Three Spirits\nStave  IV: The Last of the Spirits\nStave   V: The End of It\n\n\n\nSTAVE I:  MARLEY'S GHOST\n\nMARLEY was dead: to begin with. There is no doubt\nwhatever about that. The register of his burial was\nsigned by the clergyman, the clerk, the undertaker,\nand the chief mourner. Scrooge signed it: and\nScrooge's name was good upon 'Change, for anything he\nchose to put his hand to. Old Marley was as dead as a\ndoor-nail.\n\nMind! I don't mean to say that I know, of my\nown knowledge, what there is particularly dead about\na door-nail. I might have been inclined, myself, to\nregard a coffin-nail as the deadest piece of ironmongery\nin the trade. But the wisdom of our ancestors\nis in the simile; and my unhallowed hands\nshall not disturb it, or the Country's done for. You\nwill therefore permit me to repeat, emphatically, that\nMarley was as dead as a door-nail.\n\nScrooge knew he was dead? Of course he did.\nHow could it be otherwise? Scrooge and he were\npartners for I don't know how many years. Scrooge\nwas his sole executor, his sole administrator, his sole\nassign, his sole residuary legatee, his sole friend, and\nsole mourner. And even Scrooge was not so dreadfully\ncut up by the sad event, but that he was an excellent\nman of business on the very day of the funeral,\nand solemnised it with an undoubted bargain.\n\nThe mention of Marley's funeral brings me back to\nthe point I started from. There is no doubt that Marley\nwas dead. This must be distinctly understood, or\nnothing wonderful can come of the story I am going\nto relate. If we were not perfectly convinced that\nHamlet's Father died before the play began, there\nwould be nothing more remarkable in his taking a\nstroll at night, in an easterly wind, upon his own ramparts,\nthan there would be in any other middle-aged\ngentleman rashly turning out after dark in a breezy\nspot--say Saint Paul's Churchyard for instance--\nliterally to astonish his son's weak mind.\n\nScrooge never painted out Old Marley's name.\nThere it stood, years afterwards, above the warehouse\ndoor: Scrooge and Marley. The firm was known as\nScrooge and Marley. Sometimes people new to the\nbusiness called Scrooge Scrooge, and sometimes Marley,\nbut he answered to both names. It was all the\nsame to him.\n\nOh! But he was a tight-fisted hand at the grind-stone,\nScrooge! a squeezing, wrenching, grasping, scraping,\nclutching, covetous, old sinner! Hard and sharp as flint,\nfrom which no steel had ever struck out generous fire;\nsecret, and self-contained, and solitary as an oyster. The\ncold within him froze his old features, nipped his pointed\nnose, shrivelled his cheek, stiffened his gait; made his\neyes red, his thin lips blue; and spoke out shrewdly in his\ngrating voice. A frosty rime was on his head, and on his\neyebrows, and his wiry chin. He carried his own low\ntemperature always about with him; he iced his office in\nthe dog-days; and didn't thaw it one degree at Christmas.\n\nExternal heat and cold had little influence on\nScrooge. No warmth could warm, no wintry weather\nchill him. No wind that blew was bitterer than he,\nno falling snow was more intent upon its purpose, no\npelting rain less open to entreaty. Foul weather didn't\nknow where to have him. The heaviest rain, and\nsnow, and hail, and sleet, could boast of the advantage\nover him in only one respect. They often \"came down\"\nhandsomely, and Scrooge never did.\n\nNobody ever stopped him in the street to say, with\ngladsome looks, \"My dear Scrooge, how are you?\nWhen will you come to see me?\" No beggars implored\nhim to bestow a trifle, no children asked him\nwhat it was o'clock, no man or woman ever once in all\nhis life inquired the way to such and such a place, of\nScrooge. Even the blind men's dogs appeared to\nknow him; and when they saw him coming on, would\ntug their owners into doorways and up courts; and\nthen would wag their tails as though they said, \"No\neye at all is better than an evil eye, dark master!\"\n\nBut what did Scrooge care! It was the very thing\nhe liked. To edge his way along the crowded paths\nof life, warning all human sympathy to keep its distance,\nwas what the knowing ones call \"nuts\" to Scrooge.\n\nOnce upon a time--of all the good days in the year,\non Christmas Eve--old Scrooge sat busy in his\ncounting-house. It was cold, bleak, biting weather: foggy\nwithal: and he could hear the people in the court outside,\ngo wheezing up and down, beating their hands\nupon their breasts, and stamping their feet upon the\npavement stones to warm them. The city clocks had\nonly just gone three, but it was quite dark already--\nit had not been light all day--and candles were flaring\nin the windows of the neighbouring offices, like\nruddy smears upon the palpable brown air. The fog\ncame pouring in at every chink and keyhole, and was\nso dense without, that although the court was of the\nnarrowest, the houses opposite were mere phantoms.\nTo see the dingy cloud come drooping down, obscuring\neverything, one might have thought that Nature\nlived hard by, and was brewing on a large scale.\n\nThe door of Scrooge's counting-house was open\nthat he might keep his eye upon his clerk, who in a\ndismal little cell beyond, a sort of tank, was copying\nletters. Scrooge had a very small fire, but the clerk's\nfire was so very much smaller that it looked like one\ncoal. But he couldn't replenish it, for Scrooge kept\nthe coal-box in his own room; and so surely as the\nclerk came in with the shovel, the master predicted\nthat it would be necessary for them to part. Wherefore\nthe clerk put on his white comforter, and tried to\nwarm himself at the candle; in which effort, not being\na man of a strong imagination, he failed.\n\n\"A merry Christmas, uncle! God save you!\" cried\na cheerful voice. It was the voice of Scrooge's\nnephew, who came upon him so quickly that this was\nthe first intimation he had of his approach.\n\n\"Bah!\" said Scrooge, \"Humbug!\"\n\nHe had so heated himself with rapid walking in the\nfog and frost, this nephew of Scrooge's, that he was\nall in a glow; his face was ruddy and handsome; his\neyes sparkled, and his breath smoked again.\n\n\"Christmas a humbug, uncle!\" said Scrooge's\nnephew. \"You don't mean that, I am sure?\"\n\n\"I do,\" said Scrooge. \"Merry Christmas! What\nright have you to be merry? What reason have you\nto be merry? You're poor enough.\"\n\n\"Come, then,\" returned the nephew gaily. \"What\nright have you to be dismal? What reason have you\nto be morose? You're rich enough.\"\n\nScrooge having no better answer ready on the spur\nof the moment, said, \"Bah!\" again; and followed it up\nwith \"Humbug.\"\n\n\"Don't be cross, uncle!\" said the nephew.\n\n\"What else can I be,\" returned the uncle, \"when I\nlive in such a world of fools as this? Merry Christmas!\nOut upon merry Christmas! What's Christmas\ntime to you but a time for paying bills without\nmoney; a time for finding yourself a year older, but\nnot an hour richer; a time for balancing your books\nand having every item in 'em through a round dozen\nof months presented dead against you? If I could\nwork my will,\" said Scrooge indignantly, \"every idiot\nwho goes about with 'Merry Christmas' on his lips,\nshould be boiled with his own pudding, and buried\nwith a stake of holly through his heart. He should!\"\n\n\"Uncle!\" pleaded the nephew.\n\n\"Nephew!\" returned the uncle sternly, \"keep Christmas\nin your own way, and let me keep it in mine.\"\n\n\"Keep it!\" repeated Scrooge's nephew. \"But you\ndon't keep it.\"\n\n\"Let me leave it alone, then,\" said Scrooge. \"Much\ngood may it do you! Much good it has ever done\nyou!\"\n\n\"There are many things from which I might have\nderived good, by which I have not profited, I dare\nsay,\" returned the nephew. \"Christmas among the\nrest. But I am sure I have always thought of Christmas\ntime, when it has come round--apart from the\nveneration due to its sacred name and origin, if anything\nbelonging to it can be apart from that--as a\ngood time; a kind, forgiving, charitable, pleasant\ntime; the only time I know of, in the long calendar\nof the year, when men and women seem by one consent\nto open their shut-up hearts freely, and to think\nof people below them as if they really were\nfellow-passengers to the grave, and not another race\nof creatures bound on other journeys. And therefore,\nuncle, though it has never put a scrap of gold or\nsilver in my pocket, I believe that it has done me\ngood, and will do me good; and I say, God bless it!\"\n\nThe clerk in the Tank involuntarily applauded.\nBecoming immediately sensible of the impropriety,\nhe poked the fire, and extinguished the last frail spark\nfor ever.\n\n\"Let me hear another sound from you,\" said\nScrooge, \"and you'll keep your Christmas by losing\nyour situation! You're quite a powerful speaker,\nsir,\" he added, turning to his nephew. \"I wonder you\ndon't go into Parliament.\"\n\n\"Don't be angry, uncle. Come! Dine with us to-morrow.\"\n\nScrooge said that he would see him--yes, indeed he\ndid. He went the whole length of the expression,\nand said that he would see him in that extremity first.\n\n\"But why?\" cried Scrooge's nephew. \"Why?\"\n\n\"Why did you get married?\" said Scrooge.\n\n\"Because I fell in love.\"\n\n\"Because you fell in love!\" growled Scrooge, as if\nthat were the only one thing in the world more ridiculous\nthan a merry Christmas. \"Good afternoon!\"\n\n\"Nay, uncle, but you never came to see me before\nthat happened. Why give it as a reason for not\ncoming now?\"\n\n\"Good afternoon,\" said Scrooge.\n\n\"I want nothing from you; I ask nothing of you;\nwhy cannot we be friends?\"\n\n\"Good afternoon,\" said Scrooge.\n\n\"I am sorry, with all my heart, to find you so\nresolute. We have never had any quarrel, to which I\nhave been a party. But I have made the trial in\nhomage to Christmas, and I'll keep my Christmas\nhumour to the last. So A Merry Christmas, uncle!\"\n\n\"Good afternoon!\" said Scrooge.\n\n\"And A Happy New Year!\"\n\n\"Good afternoon!\" said Scrooge.\n\nHis nephew left the room without an angry word,\nnotwithstanding. He stopped at the outer door to\nbestow the greetings of the season on the clerk, who,\ncold as he was, was warmer than Scrooge; for he returned\nthem cordially.\n\n\"There's another fellow,\" muttered Scrooge; who\noverheard him: \"my clerk, with fifteen shillings a\nweek, and a wife and family, talking about a merry\nChristmas. I'll retire to Bedlam.\"\n\nThis lunatic, in letting Scrooge's nephew out, had\nlet two other people in. They were portly gentlemen,\npleasant to behold, and now stood, with their hats off,\nin Scrooge's office. They had books and papers in\ntheir hands, and bowed to him.\n\n\"Scrooge and Marley's, I believe,\" said one of the\ngentlemen, referring to his list. \"Have I the pleasure\nof addressing Mr. Scrooge, or Mr. Marley?\"\n\n\"Mr. Marley has been dead these seven years,\"\nScrooge replied. \"He died seven years ago, this very\nnight.\"\n\n\"We have no doubt his liberality is well represented\nby his surviving partner,\" said the gentleman, presenting\nhis credentials.\n\nIt certainly was; for they had been two kindred\nspirits. At the ominous word \"liberality,\" Scrooge\nfrowned, and shook his head, and handed the credentials\nback.\n\n\"At this festive season of the year, Mr. Scrooge,\"\nsaid the gentleman, taking up a pen, \"it is more than\nusually desirable that we should make some slight\nprovision for the Poor and destitute, who suffer\ngreatly at the present time. Many thousands are in\nwant of common necessaries; hundreds of thousands\nare in want of common comforts, sir.\"\n\n\"Are there no prisons?\" asked Scrooge.\n\n\"Plenty of prisons,\" said the gentleman, laying down\nthe pen again.\n\n\"And the Union workhouses?\" demanded Scrooge.\n\"Are they still in operation?\"\n\n\"They are. Still,\" returned the gentleman, \"I wish\nI could say they were not.\"\n\n\"The Treadmill and the Poor Law are in full vigour,\nthen?\" said Scrooge.\n\n\"Both very busy, sir.\"\n\n\"Oh! I was afraid, from what you said at first,\nthat something had occurred to stop them in their\nuseful course,\" said Scrooge. \"I'm very glad to\nhear it.\"\n\n\"Under the impression that they scarcely furnish\nChristian cheer of mind or body to the multitude,\"\nreturned the gentleman, \"a few of us are endeavouring\nto raise a fund to buy the Poor some meat and drink,\nand means of warmth. We choose this time, because\nit is a time, of all others, when Want is keenly felt,\nand Abundance rejoices. What shall I put you down\nfor?\"\n\n\"Nothing!\" Scrooge replied.\n\n\"You wish to be anonymous?\"\n\n\"I wish to be left alone,\" said Scrooge. \"Since you\nask me what I wish, gentlemen, that is my answer.\nI don't make merry myself at Christmas and I can't\nafford to make idle people merry. I help to support\nthe establishments I have mentioned--they cost\nenough; and those who are badly off must go there.\"\n\n\"Many can't go there; and many would rather die.\"\n\n\"If they would rather die,\" said Scrooge, \"they had\nbetter do it, and decrease the surplus population.\nBesides--excuse me--I don't know that.\"\n\n\"But you might know it,\" observed the gentleman.\n\n\"It's not my business,\" Scrooge returned. \"It's\nenough for a man to understand his own business, and\nnot to interfere with other people's. Mine occupies\nme constantly. Good afternoon, gentlemen!\"\n\nSeeing clearly that it would be useless to pursue\ntheir point, the gentlemen withdrew. Scrooge resumed\nhis labours with an improved opinion of himself,\nand in a more facetious temper than was usual\nwith him.\n\nMeanwhile the fog and darkness thickened so, that\npeople ran about with flaring links, proffering their\nservices to go before horses in carriages, and conduct\nthem on their way. The ancient tower of a church,\nwhose gruff old bell was always peeping slily down\nat Scrooge out of a Gothic window in the wall, became\ninvisible, and struck the hours and quarters in the\nclouds, with tremulous vibrations afterwards as if\nits teeth were chattering in its frozen head up there.\nThe cold became intense. In the main street, at the\ncorner of the court, some labourers were repairing\nthe gas-pipes, and had lighted a great fire in a brazier,\nround which a party of ragged men and boys were\ngathered: warming their hands and winking their\neyes before the blaze in rapture. The water-plug\nbeing left in solitude, its overflowings sullenly congealed,\nand turned to misanthropic ice. The brightness\nof the shops where holly sprigs and berries\ncrackled in the lamp heat of the windows, made pale\nfaces ruddy as they passed. Poulterers' and grocers'\ntrades became a splendid joke: a glorious pageant,\nwith which it was next to impossible to believe that\nsuch dull principles as bargain and sale had anything\nto do. The Lord Mayor, in the stronghold of the\nmighty Mansion House, gave orders to his fifty cooks\nand butlers to keep Christmas as a Lord Mayor's\nhousehold should; and even the little tailor, whom he\nhad fined five shillings on the previous Monday for\nbeing drunk and bloodthirsty in the streets, stirred up\nto-morrow's pudding in his garret, while his lean\nwife and the baby sallied out to buy the beef.\n\nFoggier yet, and colder. Piercing, searching, biting\ncold. If the good Saint Dunstan had but nipped\nthe Evil Spirit's nose with a touch of such weather\nas that, instead of using his familiar weapons, then\nindeed he would have roared to lusty purpose. The\nowner of one scant young nose, gnawed and mumbled\nby the hungry cold as bones are gnawed by dogs,\nstooped down at Scrooge's keyhole to regale him with\na Christmas carol: but at the first sound of\n\n        \"God bless you, merry gentleman!\n         May nothing you dismay!\"\n\nScrooge seized the ruler with such energy of action,\nthat the singer fled in terror, leaving the keyhole to\nthe fog and even more congenial frost.\n\nAt length the hour of shutting up the counting-house\narrived. With an ill-will Scrooge dismounted from his\nstool, and tacitly admitted the fact to the expectant\nclerk in the Tank, who instantly snuffed his candle out,\nand put on his hat.\n\n\"You'll want all day to-morrow, I suppose?\" said\nScrooge.\n\n\"If quite convenient, sir.\"\n\n\"It's not convenient,\" said Scrooge, \"and it's not\nfair. If I was to stop half-a-crown for it, you'd\nthink yourself ill-used, I'll be bound?\"\n\nThe clerk smiled faintly.\n\n\"And yet,\" said Scrooge, \"you don't think me ill-used,\nwhen I pay a day's wages for no work.\"\n\nThe clerk observed that it was only once a year.\n\n\"A poor excuse for picking a man's pocket every\ntwenty-fifth of December!\" said Scrooge, buttoning\nhis great-coat to the chin. \"But I suppose you must\nhave the whole day. Be here all the earlier next\nmorning.\"\n\nThe clerk promised that he would; and Scrooge\nwalked out with a growl. The office was closed in a\ntwinkling, and the clerk, with the long ends of his\nwhite comforter dangling below his waist (for he\nboasted no great-coat), went down a slide on Cornhill,\nat the end of a lane of boys, twenty times, in\nhonour of its being Christmas Eve, and then ran home\nto Camden Town as hard as he could pelt, to play\nat blindman's-buff.\n\nScrooge took his melancholy dinner in his usual\nmelancholy tavern; and having read all the newspapers, and\nbeguiled the rest of the evening with his\nbanker's-book, went home to bed. He lived in\nchambers which had once belonged to his deceased\npartner. They were a gloomy suite of rooms, in a\nlowering pile of building up a yard, where it had so\nlittle business to be, that one could scarcely help\nfancying it must have run there when it was a young\nhouse, playing at hide-and-seek with other houses,\nand forgotten the way out again. It was old enough\nnow, and dreary enough, for nobody lived in it but\nScrooge, the other rooms being all let out as offices.\nThe yard was so dark that even Scrooge, who knew\nits every stone, was fain to grope with his hands.\nThe fog and frost so hung about the black old gateway\nof the house, that it seemed as if the Genius of\nthe Weather sat in mournful meditation on the\nthreshold.\n\nNow, it is a fact, that there was nothing at all\nparticular about the knocker on the door, except that it\nwas very large. It is also a fact, that Scrooge had\nseen it, night and morning, during his whole residence\nin that place; also that Scrooge had as little of what\nis called fancy about him as any man in the city of\nLondon, even including--which is a bold word--the\ncorporation, aldermen, and livery. Let it also be\nborne in mind that Scrooge had not bestowed one\nthought on Marley, since his last mention of his\nseven years' dead partner that afternoon. And then\nlet any man explain to me, if he can, how it happened\nthat Scrooge, having his key in the lock of the door,\nsaw in the knocker, without its undergoing any intermediate\nprocess of change--not a knocker, but Marley's face.\n\nMarley's face. It was not in impenetrable shadow\nas the other objects in the yard were, but had a\ndismal light about it, like a bad lobster in a dark\ncellar. It was not angry or ferocious, but looked\nat Scrooge as Marley used to look: with ghostly\nspectacles turned up on its ghostly forehead. The\nhair was curiously stirred, as if by breath or hot air;\nand, though the eyes were wide open, they were perfectly\nmotionless. That, and its livid colour, made it\nhorrible; but its horror seemed to be in spite of the\nface and beyond its control, rather than a part of\nits own expression.\n\nAs Scrooge looked fixedly at this phenomenon, it\nwas a knocker again.\n\nTo say that he was not startled, or that his blood\nwas not conscious of a terrible sensation to which it\nhad been a stranger from infancy, would be untrue.\nBut he put his hand upon the key he had relinquished,\nturned it sturdily, walked in, and lighted his candle.\n\nHe did pause, with a moment's irresolution, before\nhe shut the door; and he did look cautiously behind\nit first, as if he half expected to be terrified with the\nsight of Marley's pigtail sticking out into the hall.\nBut there was nothing on the back of the door, except\nthe screws and nuts that held the knocker on, so he\nsaid \"Pooh, pooh!\" and closed it with a bang.\n\nThe sound resounded through the house like thunder.\nEvery room above, and every cask in the wine-merchant's\ncellars below, appeared to have a separate peal\nof echoes of its own. Scrooge was not a man to\nbe frightened by echoes. He fastened the door, and\nwalked across the hall, and up the stairs; slowly too:\ntrimming his candle as he went.\n\nYou may talk vaguely about driving a coach-and-six\nup a good old flight of stairs, or through a bad\nyoung Act of Parliament; but I mean to say you\nmight have got a hearse up that staircase, and taken\nit broadwise, with the splinter-bar towards the wall\nand the door towards the balustrades: and done it\neasy. There was plenty of width for that, and room\nto spare; which is perhaps the reason why Scrooge\nthought he saw a locomotive hearse going on before\nhim in the gloom. Half-a-dozen gas-lamps out of\nthe street wouldn't have lighted the entry too well,\nso you may suppose that it was pretty dark with\nScrooge's dip.\n\nUp Scrooge went, not caring a button for that.\nDarkness is cheap, and Scrooge liked it. But before\nhe shut his heavy door, he walked through his rooms\nto see that all was right. He had just enough recollection\nof the face to desire to do that.\n\nSitting-room, bedroom, lumber-room. All as they\nshould be. Nobody under the table, nobody under\nthe sofa; a small fire in the grate; spoon and basin\nready; and the little saucepan of gruel (Scrooge had\na cold in his head) upon the hob. Nobody under the\nbed; nobody in the closet; nobody in his dressing-gown,\nwhich was hanging up in a suspicious attitude\nagainst the wall. Lumber-room as usual. Old fire-guard,\nold shoes, two fish-baskets, washing-stand on three\nlegs, and a poker.\n\nQuite satisfied, he closed his door, and locked\nhimself in; double-locked himself in, which was not his\ncustom. Thus secured against surprise, he took off\nhis cravat; put on his dressing-gown and slippers, and\nhis nightcap; and sat down before the fire to take\nhis gruel.\n\nIt was a very low fire indeed; nothing on such a\nbitter night. He was obliged to sit close to it, and\nbrood over it, before he could extract the least\nsensation of warmth from such a handful of fuel.\nThe fireplace was an old one, built by some Dutch\nmerchant long ago, and paved all round with quaint\nDutch tiles, designed to illustrate the Scriptures.\nThere were Cains and Abels, Pharaoh's daughters;\nQueens of Sheba, Angelic messengers descending\nthrough the air on clouds like feather-beds, Abrahams,\nBelshazzars, Apostles putting off to sea in butter-boats,\nhundreds of figures to attract his thoughts;\nand yet that face of Marley, seven years dead, came\nlike the ancient Prophet's rod, and swallowed up the\nwhole. If each smooth tile had been a blank at first,\nwith power to shape some picture on its surface from\nthe disjointed fragments of his thoughts, there would\nhave been a copy of old Marley's head on every one.\n\n\"Humbug!\" said Scrooge; and walked across the\nroom.\n\nAfter several turns, he sat down again. As he\nthrew his head back in the chair, his glance happened\nto rest upon a bell, a disused bell, that hung in the\nroom, and communicated for some purpose now forgotten\nwith a chamber in the highest story of the\nbuilding. It was with great astonishment, and with\na strange, inexplicable dread, that as he looked, he\nsaw this bell begin to swing. It swung so softly in\nthe outset that it scarcely made a sound; but soon it\nrang out loudly, and so did every bell in the house.\n\nThis might have lasted half a minute, or a minute,\nbut it seemed an hour. The bells ceased as they had\nbegun, together. They were succeeded by a clanking\nnoise, deep down below; as if some person were\ndragging a heavy chain over the casks in the\nwine-merchant's cellar. Scrooge then remembered to have\nheard that ghosts in haunted houses were described as\ndragging chains.\n\nThe cellar-door flew open with a booming sound,\nand then he heard the noise much louder, on the floors\nbelow; then coming up the stairs; then coming straight\ntowards his door.\n\n\"It's humbug still!\" said Scrooge. \"I won't believe it.\"\n\nHis colour changed though, when, without a pause,\nit came on through the heavy door, and passed into\nthe room before his eyes. Upon its coming in, the\ndying flame leaped up, as though it cried, \"I know\nhim; Marley's Ghost!\" and fell again.\n\nThe same face: the very same. Marley in his pigtail,\nusual waistcoat, tights and boots; the tassels on\nthe latter bristling, like his pigtail, and his coat-skirts,\nand the hair upon his head. The chain he drew was\nclasped about his middle. It was long, and wound\nabout him like a tail; and it was made (for Scrooge\nobserved it closely) of cash-boxes, keys, padlocks,\nledgers, deeds, and heavy purses wrought in steel.\nHis body was transparent; so that Scrooge, observing him,\nand looking through his waistcoat, could see\nthe two buttons on his coat behind.\n\nScrooge had often heard it said that Marley had no\nbowels, but he had never believed it until now.\n\nNo, nor did he believe it even now. Though he\nlooked the phantom through and through, and saw\nit standing before him; though he felt the chilling\ninfluence of its death-cold eyes; and marked the very\ntexture of the folded kerchief bound about its head\nand chin, which wrapper he had not observed before;\nhe was still incredulous, and fought against his senses.\n\n\"How now!\" said Scrooge, caustic and cold as ever.\n\"What do you want with me?\"\n\n\"Much!\"--Marley's voice, no doubt about it.\n\n\"Who are you?\"\n\n\"Ask me who I was.\"\n\n\"Who were you then?\" said Scrooge, raising his\nvoice. \"You're particular, for a shade.\" He was going\nto say \"to a shade,\" but substituted this, as more\nappropriate.\n\n\"In life I was your partner, Jacob Marley.\"\n\n\"Can you--can you sit down?\" asked Scrooge, looking\ndoubtfully at him.\n\n\"I can.\"\n\n\"Do it, then.\"\n\nScrooge asked the question, because he didn't know\nwhether a ghost so transparent might find himself in\na condition to take a chair; and felt that in the event\nof its being impossible, it might involve the necessity\nof an embarrassing explanation. But the ghost sat\ndown on the opposite side of the fireplace, as if he\nwere quite used to it.\n\n\"You don't believe in me,\" observed the Ghost.\n\n\"I don't,\" said Scrooge.\n\n\"What evidence would you have of my reality beyond that of\nyour senses?\"\n\n\"I don't know,\" said Scrooge.\n\n\"Why do you doubt your senses?\"\n\n\"Because,\" said Scrooge, \"a little thing affects them.\nA slight disorder of the stomach makes them cheats. You may\nbe an undigested bit of beef, a blot of mustard, a crumb of\ncheese, a fragment of an underdone potato. There's more of\ngravy than of grave about you, whatever you are!\"\n\nScrooge was not much in the habit of cracking\njokes, nor did he feel, in his heart, by any means\nwaggish then. The truth is, that he tried to be\nsmart, as a means of distracting his own attention,\nand keeping down his terror; for the spectre's voice\ndisturbed the very marrow in his bones.\n\nTo sit, staring at those fixed glazed eyes, in silence\nfor a moment, would play, Scrooge felt, the very\ndeuce with him. There was something very awful,\ntoo, in the spectre's being provided with an infernal\natmosphere of its own. Scrooge could not feel it\nhimself, but this was clearly the case; for though the\nGhost sat perfectly motionless, its hair, and skirts,\nand tassels, were still agitated as by the hot vapour\nfrom an oven.\n\n\"You see this toothpick?\" said Scrooge, returning\nquickly to the charge, for the reason just assigned;\nand wishing, though it were only for a second, to\ndivert the vision's stony gaze from himself.\n\n\"I do,\" replied the Ghost.\n\n\"You are not looking at it,\" said Scrooge.\n\n\"But I see it,\" said the Ghost, \"notwithstanding.\"\n\n\"Well!\" returned Scrooge, \"I have but to swallow\nthis, and be for the rest of my days persecuted by a\nlegion of goblins, all of my own creation. Humbug,\nI tell you! humbug!\"\n\nAt this the spirit raised a frightful cry, and shook\nits chain with such a dismal and appalling noise, that\nScrooge held on tight to his chair, to save himself\nfrom falling in a swoon. But how much greater was\nhis horror, when the phantom taking off the bandage\nround its head, as if it were too warm to wear indoors,\nits lower jaw dropped down upon its breast!\n\nScrooge fell upon his knees, and clasped his hands\nbefore his face.\n\n\"Mercy!\" he said. \"Dreadful apparition, why do\nyou trouble me?\"\n\n\"Man of the worldly mind!\" replied the Ghost, \"do\nyou believe in me or not?\"\n\n\"I do,\" said Scrooge. \"I must. But why do spirits\nwalk the earth, and why do they come to me?\"\n\n\"It is required of every man,\" the Ghost returned,\n\"that the spirit within him should walk abroad among\nhis fellowmen, and travel far and wide; and if that\nspirit goes not forth in life, it is condemned to do so\nafter death. It is doomed to wander through the\nworld--oh, woe is me!--and witness what it cannot\nshare, but might have shared on earth, and turned to\nhappiness!\"\n\nAgain the spectre raised a cry, and shook its chain\nand wrung its shadowy hands.\n\n\"You are fettered,\" said Scrooge, trembling. \"Tell\nme why?\"\n\n\"I wear the chain I forged in life,\" replied the Ghost.\n\"I made it link by link, and yard by yard; I girded\nit on of my own free will, and of my own free will I\nwore it. Is its pattern strange to you?\"\n\nScrooge trembled more and more.\n\n\"Or would you know,\" pursued the Ghost, \"the\nweight and length of the strong coil you bear yourself?\nIt was full as heavy and as long as this, seven\nChristmas Eves ago. You have laboured on it, since.\nIt is a ponderous chain!\"\n\nScrooge glanced about him on the floor, in the\nexpectation of finding himself surrounded by some fifty\nor sixty fathoms of iron cable: but he could see\nnothing.\n\n\"Jacob,\" he said, imploringly. \"Old Jacob Marley,\ntell me more. Speak comfort to me, Jacob!\"\n\n\"I have none to give,\" the Ghost replied. \"It comes\nfrom other regions, Ebenezer Scrooge, and is conveyed\nby other ministers, to other kinds of men. Nor\ncan I tell you what I would. A very little more is\nall permitted to me. I cannot rest, I cannot stay, I\ncannot linger anywhere. My spirit never walked\nbeyond our counting-house--mark me!--in life my\nspirit never roved beyond the narrow limits of our\nmoney-changing hole; and weary journeys lie before\nme!\"\n\nIt was a habit with Scrooge, whenever he became\nthoughtful, to put his hands in his breeches pockets.\nPondering on what the Ghost had said, he did so now,\nbut without lifting up his eyes, or getting off his\nknees.\n\n\"You must have been very slow about it, Jacob,\"\nScrooge observed, in a business-like manner, though\nwith humility and deference.\n\n\"Slow!\" the Ghost repeated.\n\n\"Seven years dead,\" mused Scrooge. \"And travelling\nall the time!\"\n\n\"The whole time,\" said the Ghost. \"No rest, no\npeace. Incessant torture of remorse.\"\n\n\"You travel fast?\" said Scrooge.\n\n\"On the wings of the wind,\" replied the Ghost.\n\n\"You might have got over a great quantity of\nground in seven years,\" said Scrooge.\n\nThe Ghost, on hearing this, set up another cry, and\nclanked its chain so hideously in the dead silence of\nthe night, that the Ward would have been justified in\nindicting it for a nuisance.\n\n\"Oh! captive, bound, and double-ironed,\" cried the\nphantom, \"not to know, that ages of incessant labour\nby immortal creatures, for this earth must pass into\neternity before the good of which it is susceptible is\nall developed. Not to know that any Christian spirit\nworking kindly in its little sphere, whatever it may\nbe, will find its mortal life too short for its vast\nmeans of usefulness. Not to know that no space of\nregret can make amends for one life's opportunity\nmisused! Yet such was I! Oh! such was I!\"\n\n\"But you were always a good man of business,\nJacob,\" faltered Scrooge, who now began to apply this\nto himself.\n\n\"Business!\" cried the Ghost, wringing its hands\nagain. \"Mankind was my business. The common\nwelfare was my business; charity, mercy, forbearance,\nand benevolence, were, all, my business. The dealings\nof my trade were but a drop of water in the\ncomprehensive ocean of my business!\"\n\nIt held up its chain at arm's length, as if that were\nthe cause of all its unavailing grief, and flung it\nheavily upon the ground again.\n\n\"At this time of the rolling year,\" the spectre said,\n\"I suffer most. Why did I walk through crowds of\nfellow-beings with my eyes turned down, and never\nraise them to that blessed Star which led the Wise\nMen to a poor abode! Were there no poor homes to\nwhich its light would have conducted me!\"\n\nScrooge was very much dismayed to hear the\nspectre going on at this rate, and began to quake\nexceedingly.\n\n\"Hear me!\" cried the Ghost. \"My time is nearly\ngone.\"\n\n\"I will,\" said Scrooge. \"But don't be hard upon\nme! Don't be flowery, Jacob! Pray!\"\n\n\"How it is that I appear before you in a shape that\nyou can see, I may not tell. I have sat invisible\nbeside you many and many a day.\"\n\nIt was not an agreeable idea. Scrooge shivered,\nand wiped the perspiration from his brow.\n\n\"That is no light part of my penance,\" pursued\nthe Ghost. \"I am here to-night to warn you, that you\nhave yet a chance and hope of escaping my fate. A\nchance and hope of my procuring, Ebenezer.\"\n\n\"You were always a good friend to me,\" said\nScrooge. \"Thank'ee!\"\n\n\"You will be haunted,\" resumed the Ghost, \"by\nThree Spirits.\"\n\nScrooge's countenance fell almost as low as the\nGhost's had done.\n\n\"Is that the chance and hope you mentioned,\nJacob?\" he demanded, in a faltering voice.\n\n\"It is.\"\n\n\"I--I think I'd rather not,\" said Scrooge.\n\n\"Without their visits,\" said the Ghost, \"you cannot\nhope to shun the path I tread. Expect the first to-morrow,\nwhen the bell tolls One.\"\n\n\"Couldn't I take 'em all at once, and have it over,\nJacob?\" hinted Scrooge.\n\n\"Expect the second on the next night at the same\nhour. The third upon the next night when the last\nstroke of Twelve has ceased to vibrate. Look to see\nme no more; and look that, for your own sake, you\nremember what has passed between us!\"\n\nWhen it had said these words, the spectre took its\nwrapper from the table, and bound it round its head,\nas before. Scrooge knew this, by the smart sound its\nteeth made, when the jaws were brought together\nby the bandage. He ventured to raise his eyes again,\nand found his supernatural visitor confronting him\nin an erect attitude, with its chain wound over and\nabout its arm.\n\nThe apparition walked backward from him; and at\nevery step it took, the window raised itself a little,\nso that when the spectre reached it, it was wide open.\n\nIt beckoned Scrooge to approach, which he did.\nWhen they were within two paces of each other,\nMarley's Ghost held up its hand, warning him to\ncome no nearer. Scrooge stopped.\n\nNot so much in obedience, as in surprise and fear:\nfor on the raising of the hand, he became sensible\nof confused noises in the air; incoherent sounds of\nlamentation and regret; wailings inexpressibly sorrowful and\nself-accusatory. The spectre, after listening for a moment,\njoined in the mournful dirge; and floated out upon the\nbleak, dark night.\n\nScrooge followed to the window: desperate in his\ncuriosity. He looked out.\n\nThe air was filled with phantoms, wandering hither\nand thither in restless haste, and moaning as they\nwent. Every one of them wore chains like Marley's\nGhost; some few (they might be guilty governments)\nwere linked together; none were free. Many had\nbeen personally known to Scrooge in their lives. He\nhad been quite familiar with one old ghost, in a white\nwaistcoat, with a monstrous iron safe attached to\nits ankle, who cried piteously at being unable to assist\na wretched woman with an infant, whom it saw below,\nupon a door-step. The misery with them all was,\nclearly, that they sought to interfere, for good, in\nhuman matters, and had lost the power for ever.\n\nWhether these creatures faded into mist, or mist\nenshrouded them, he could not tell. But they and\ntheir spirit voices faded together; and the night became\nas it had been when he walked home.\n\nScrooge closed the window, and examined the door\nby which the Ghost had entered. It was double-locked,\nas he had locked it with his own hands, and\nthe bolts were undisturbed. He tried to say \"Humbug!\"\nbut stopped at the first syllable. And being,\nfrom the emotion he had undergone, or the fatigues\nof the day, or his glimpse of the Invisible World, or\nthe dull conversation of the Ghost, or the lateness of\nthe hour, much in need of repose; went straight to\nbed, without undressing, and fell asleep upon the\ninstant.\n\n\nSTAVE II:  THE FIRST OF THE THREE SPIRITS\n\nWHEN Scrooge awoke, it was so dark, that looking out of bed,\nhe could scarcely distinguish the transparent window from\nthe opaque walls of his chamber. He was endeavouring to\npierce the darkness with his ferret eyes, when the chimes of a\nneighbouring church struck the four quarters. So he listened\nfor the hour.\n\nTo his great astonishment the heavy bell went on from\nsix to seven, and from seven to eight, and regularly up to\ntwelve; then stopped. Twelve! It was past two when he\nwent to bed. The clock was wrong. An icicle must have\ngot into the works. Twelve!\n\nHe touched the spring of his repeater, to correct this most\npreposterous clock. Its rapid little pulse beat twelve:\nand stopped.\n\n\"Why, it isn't possible,\" said Scrooge, \"that I can have\nslept through a whole day and far into another night. It\nisn't possible that anything has happened to the sun, and\nthis is twelve at noon!\"\n\nThe idea being an alarming one, he scrambled out of bed,\nand groped his way to the window. He was obliged to rub\nthe frost off with the sleeve of his dressing-gown before he\ncould see anything; and could see very little then. All he\ncould make out was, that it was still very foggy and extremely\ncold, and that there was no noise of people running to and fro,\nand making a great stir, as there unquestionably would have been\nif night had beaten off bright day, and taken possession of the\nworld.  This was a great relief, because \"three days after sight\nof this First of Exchange pay to Mr. Ebenezer Scrooge or his\norder,\" and so forth, would have become a mere United States'\nsecurity if there were no days to count by.\n\nScrooge went to bed again, and thought, and thought, and thought\nit over and over and over, and could make nothing of it.  The more he\nthought, the more perplexed he was; and the more he endeavoured\nnot to think, the more he thought.\n\nMarley's Ghost bothered him exceedingly. Every time he resolved\nwithin himself, after mature inquiry, that it was all a dream, his\nmind flew back again, like a strong spring released, to its first\nposition, and presented the same problem to be worked all through,\n\"Was it a dream or not?\"\n\nScrooge lay in this state until the chime had gone three quarters\nmore, when he remembered, on a sudden, that the Ghost had warned\nhim of a visitation when the bell tolled one.  He resolved to lie\nawake until the hour was passed; and, considering that he could\nno more go to sleep than go to Heaven, this was perhaps the\nwisest resolution in his power.\n\nThe quarter was so long, that he was more than once convinced he\nmust have sunk into a doze unconsciously, and missed the clock.\nAt length it broke upon his listening ear.\n\n\"Ding, dong!\"\n\n\"A quarter past,\" said Scrooge, counting.\n\n\"Ding, dong!\"\n\n\"Half-past!\" said Scrooge.\n\n\"Ding, dong!\"\n\n\"A quarter to it,\" said Scrooge.\n\n\"Ding, dong!\"\n\n\"The hour itself,\" said Scrooge, triumphantly, \"and nothing else!\"\n\nHe spoke before the hour bell sounded, which it now did with a\ndeep, dull, hollow, melancholy ONE.  Light flashed up in the room\nupon the instant, and the curtains of his bed were drawn.\n\nThe curtains of his bed were drawn aside, I tell you, by a\nhand. Not the curtains at his feet, nor the curtains at his\nback, but those to which his face was addressed. The curtains\nof his bed were drawn aside; and Scrooge, starting up into a\nhalf-recumbent attitude, found himself face to face with the\nunearthly visitor who drew them: as close to it as I am now\nto you, and I am standing in the spirit at your elbow.\n\nIt was a strange figure--like a child: yet not so like a\nchild as like an old man, viewed through some supernatural\nmedium, which gave him the appearance of having receded\nfrom the view, and being diminished to a child's proportions.\nIts hair, which hung about its neck and down its back, was\nwhite as if with age; and yet the face had not a wrinkle in\nit, and the tenderest bloom was on the skin. The arms were\nvery long and muscular; the hands the same, as if its hold\nwere of uncommon strength. Its legs and feet, most delicately\nformed, were, like those upper members, bare. It wore a tunic\nof the purest white; and round its waist was bound\na lustrous belt, the sheen of which was beautiful. It held\na branch of fresh green holly in its hand; and, in singular\ncontradiction of that wintry emblem, had its dress trimmed\nwith summer flowers. But the strangest thing about it was,\nthat from the crown of its head there sprung a bright clear\njet of light, by which all this was visible; and which was\ndoubtless the occasion of its using, in its duller moments, a\ngreat extinguisher for a cap, which it now held under its arm.\n\nEven this, though, when Scrooge looked at it with increasing\nsteadiness, was not its strangest quality. For as its belt\nsparkled and glittered now in one part and now in another,\nand what was light one instant, at another time was dark, so\nthe figure itself fluctuated in its distinctness: being now a\nthing with one arm, now with one leg, now with twenty legs,\nnow a pair of legs without a head, now a head without a\nbody: of which dissolving parts, no outline would be visible\nin the dense gloom wherein they melted away. And in the\nvery wonder of this, it would be itself again; distinct and\nclear as ever.\n\n\"Are you the Spirit, sir, whose coming was foretold to\nme?\" asked Scrooge.\n\n\"I am!\"\n\nThe voice was soft and gentle. Singularly low, as if\ninstead of being so close beside him, it were at a distance.\n\n\"Who, and what are you?\" Scrooge demanded.\n\n\"I am the Ghost of Christmas Past.\"\n\n\"Long Past?\" inquired Scrooge: observant of its dwarfish\nstature.\n\n\"No. Your past.\"\n\nPerhaps, Scrooge could not have told anybody why, if\nanybody could have asked him; but he had a special desire\nto see the Spirit in his cap; and begged him to be covered.\n\n\"What!\" exclaimed the Ghost, \"would you so soon put out,\nwith worldly hands, the light I give? Is it not enough\nthat you are one of those whose passions made this cap, and\nforce me through whole trains of years to wear it low upon\nmy brow!\"\n\nScrooge reverently disclaimed all intention to offend\nor any knowledge of having wilfully \"bonneted\" the Spirit at\nany period of his life. He then made bold to inquire what\nbusiness brought him there.\n\n\"Your welfare!\" said the Ghost.\n\nScrooge expressed himself much obliged, but could not\nhelp thinking that a night of unbroken rest would have been\nmore conducive to that end. The Spirit must have heard\nhim thinking, for it said immediately:\n\n\"Your reclamation, then. Take heed!\"\n\nIt put out its strong hand as it spoke, and clasped him\ngently by the arm.\n\n\"Rise! and walk with me!\"\n\nIt would have been in vain for Scrooge to plead that the\nweather and the hour were not adapted to pedestrian purposes;\nthat bed was warm, and the thermometer a long way below\nfreezing; that he was clad but lightly in his slippers,\ndressing-gown, and nightcap; and that he had a cold upon him at\nthat time. The grasp, though gentle as a woman's hand,\nwas not to be resisted. He rose: but finding that the Spirit\nmade towards the window, clasped his robe in supplication.\n\n\"I am a mortal,\" Scrooge remonstrated, \"and liable to fall.\"\n\n\"Bear but a touch of my hand there,\" said the Spirit,\nlaying it upon his heart, \"and you shall be upheld in more\nthan this!\"\n\nAs the words were spoken, they passed through the wall,\nand stood upon an open country road, with fields on either\nhand. The city had entirely vanished. Not a vestige of it\nwas to be seen. The darkness and the mist had vanished\nwith it, for it was a clear, cold, winter day, with snow upon\nthe ground.\n\n\"Good Heaven!\" said Scrooge, clasping his hands together,\nas he looked about him. \"I was bred in this place. I was\na boy here!\"\n\nThe Spirit gazed upon him mildly. Its gentle touch,\nthough it had been light and instantaneous, appeared still\npresent to the old man's sense of feeling. He was conscious\nof a thousand odours floating in the air, each one connected\nwith a thousand thoughts, and hopes, and joys, and cares\nlong, long, forgotten!\n\n\"Your lip is trembling,\" said the Ghost. \"And what is\nthat upon your cheek?\"\n\nScrooge muttered, with an unusual catching in his voice,\nthat it was a pimple; and begged the Ghost to lead him\nwhere he would.\n\n\"You recollect the way?\" inquired the Spirit.\n\n\"Remember it!\" cried Scrooge with fervour; \"I could\nwalk it blindfold.\"\n\n\"Strange to have forgotten it for so many years!\" observed\nthe Ghost. \"Let us go on.\"\n\nThey walked along the road, Scrooge recognising every\ngate, and post, and tree; until a little market-town appeared\nin the distance, with its bridge, its church, and winding river.\nSome shaggy ponies now were seen trotting towards them\nwith boys upon their backs, who called to other boys in\ncountry gigs and carts, driven by farmers. All these boys\nwere in great spirits, and shouted to each other, until the\nbroad fields were so full of merry music, that the crisp air\nlaughed to hear it!\n\n\"These are but shadows of the things that have been,\" said\nthe Ghost. \"They have no consciousness of us.\"\n\nThe jocund travellers came on; and as they came, Scrooge\nknew and named them every one. Why was he rejoiced beyond\nall bounds to see them! Why did his cold eye glisten, and\nhis heart leap up as they went past! Why was he filled\nwith gladness when he heard them give each other Merry\nChristmas, as they parted at cross-roads and bye-ways, for\ntheir several homes! What was merry Christmas to Scrooge?\nOut upon merry Christmas! What good had it ever done\nto him?\n\n\"The school is not quite deserted,\" said the Ghost. \"A\nsolitary child, neglected by his friends, is left there still.\"\n\nScrooge said he knew it. And he sobbed.\n\nThey left the high-road, by a well-remembered lane, and\nsoon approached a mansion of dull red brick, with a little\nweathercock-surmounted cupola, on the roof, and a bell\nhanging in it. It was a large house, but one of broken\nfortunes; for the spacious offices were little used, their walls\nwere damp and mossy, their windows broken, and their\ngates decayed. Fowls clucked and strutted in the stables;\nand the coach-houses and sheds were over-run with grass.\nNor was it more retentive of its ancient state, within; for\nentering the dreary hall, and glancing through the open\ndoors of many rooms, they found them poorly furnished,\ncold, and vast. There was an earthy savour in the air, a\nchilly bareness in the place, which associated itself somehow\nwith too much getting up by candle-light, and not too\nmuch to eat.\n\nThey went, the Ghost and Scrooge, across the hall, to a\ndoor at the back of the house. It opened before them, and\ndisclosed a long, bare, melancholy room, made barer still by\nlines of plain deal forms and desks. At one of these a lonely\nboy was reading near a feeble fire; and Scrooge sat down\nupon a form, and wept to see his poor forgotten self as he\nused to be.\n\nNot a latent echo in the house, not a squeak and scuffle\nfrom the mice behind the panelling, not a drip from the\nhalf-thawed water-spout in the dull yard behind, not a sigh among\nthe leafless boughs of one despondent poplar, not the idle\nswinging of an empty store-house door, no, not a clicking in\nthe fire, but fell upon the heart of Scrooge with a softening\ninfluence, and gave a freer passage to his tears.\n\nThe Spirit touched him on the arm, and pointed to his\nyounger self, intent upon his reading. Suddenly a man, in\nforeign garments: wonderfully real and distinct to look at:\nstood outside the window, with an axe stuck in his belt, and\nleading by the bridle an ass laden with wood.\n\n\"Why, it's Ali Baba!\" Scrooge exclaimed in ecstasy. \"It's\ndear old honest Ali Baba! Yes, yes, I know! One Christmas\ntime, when yonder solitary child was left here all alone,\nhe did come, for the first time, just like that. Poor boy! And\nValentine,\" said Scrooge, \"and his wild brother, Orson; there\nthey go! And what's his name, who was put down in his\ndrawers, asleep, at the Gate of Damascus; don't you see him!\nAnd the Sultan's Groom turned upside down by the Genii;\nthere he is upon his head! Serve him right. I'm glad of it.\nWhat business had he to be married to the Princess!\"\n\nTo hear Scrooge expending all the earnestness of his nature\non such subjects, in a most extraordinary voice between\nlaughing and crying; and to see his heightened and excited\nface; would have been a surprise to his business friends in\nthe city, indeed.\n\n\"There's the Parrot!\" cried Scrooge. \"Green body and\nyellow tail, with a thing like a lettuce growing out of the\ntop of his head; there he is! Poor Robin Crusoe, he called\nhim, when he came home again after sailing round the\nisland. 'Poor Robin Crusoe, where have you been, Robin\nCrusoe?'  The man thought he was dreaming, but he wasn't.\nIt was the Parrot, you know. There goes Friday, running\nfor his life to the little creek! Halloa! Hoop! Halloo!\"\n\nThen, with a rapidity of transition very foreign to his\nusual character, he said, in pity for his former self, \"Poor\nboy!\" and cried again.\n\n\"I wish,\" Scrooge muttered, putting his hand in his\npocket, and looking about him, after drying his eyes with his\ncuff: \"but it's too late now.\"\n\n\"What is the matter?\" asked the Spirit.\n\n\"Nothing,\" said Scrooge. \"Nothing. There was a boy\nsinging a Christmas Carol at my door last night. I should\nlike to have given him something: that's all.\"\n\nThe Ghost smiled thoughtfully, and waved its hand:\nsaying as it did so, \"Let us see another Christmas!\"\n\nScrooge's former self grew larger at the words, and the\nroom became a little darker and more dirty. The panels shrunk,\nthe windows cracked; fragments of plaster fell out of the\nceiling, and the naked laths were shown instead; but how\nall this was brought about, Scrooge knew no more than you\ndo. He only knew that it was quite correct; that everything\nhad happened so; that there he was, alone again, when all\nthe other boys had gone home for the jolly holidays.\n\nHe was not reading now, but walking up and down despairingly.\nScrooge looked at the Ghost, and with a mournful shaking of\nhis head, glanced anxiously towards the door.\n\nIt opened; and a little girl, much younger than the boy,\ncame darting in, and putting her arms about his neck, and\noften kissing him, addressed him as her \"Dear, dear\nbrother.\"\n\n\"I have come to bring you home, dear brother!\" said the\nchild, clapping her tiny hands, and bending down to laugh.\n\"To bring you home, home, home!\"\n\n\"Home, little Fan?\" returned the boy.\n\n\"Yes!\" said the child, brimful of glee. \"Home, for good\nand all. Home, for ever and ever. Father is so much kinder\nthan he used to be, that home's like Heaven! He spoke so\ngently to me one dear night when I was going to bed, that\nI was not afraid to ask him once more if you might come\nhome; and he said Yes, you should; and sent me in a coach\nto bring you. And you're to be a man!\" said the child,\nopening her eyes, \"and are never to come back here; but\nfirst, we're to be together all the Christmas long, and have\nthe merriest time in all the world.\"\n\n\"You are quite a woman, little Fan!\" exclaimed the boy.\n\nShe clapped her hands and laughed, and tried to touch his\nhead; but being too little, laughed again, and stood on\ntiptoe to embrace him. Then she began to drag him, in her\nchildish eagerness, towards the door; and he, nothing loth to\ngo, accompanied her.\n\nA terrible voice in the hall cried, \"Bring down Master\nScrooge's box, there!\" and in the hall appeared the schoolmaster\nhimself, who glared on Master Scrooge with a ferocious\ncondescension, and threw him into a dreadful state of mind\nby shaking hands with him. He then conveyed him and his\nsister into the veriest old well of a shivering best-parlour that\never was seen, where the maps upon the wall, and the celestial\nand terrestrial globes in the windows, were waxy with cold.\nHere he produced a decanter of curiously light wine, and a\nblock of curiously heavy cake, and administered instalments\nof those dainties to the young people: at the same time,\nsending out a meagre servant to offer a glass of \"something\"\nto the postboy, who answered that he thanked the gentleman,\nbut if it was the same tap as he had tasted before, he had\nrather not. Master Scrooge's trunk being by this time tied\non to the top of the chaise, the children bade the schoolmaster\ngood-bye right willingly; and getting into it, drove\ngaily down the garden-sweep: the quick wheels dashing the\nhoar-frost and snow from off the dark leaves of the evergreens\nlike spray.\n\n\"Always a delicate creature, whom a breath might have\nwithered,\" said the Ghost. \"But she had a large heart!\"\n\n\"So she had,\" cried Scrooge. \"You're right. I will not\ngainsay it, Spirit. God forbid!\"\n\n\"She died a woman,\" said the Ghost, \"and had, as I think,\nchildren.\"\n\n\"One child,\" Scrooge returned.\n\n\"True,\" said the Ghost. \"Your nephew!\"\n\nScrooge seemed uneasy in his mind; and answered briefly,\n\"Yes.\"\n\nAlthough they had but that moment left the school behind\nthem, they were now in the busy thoroughfares of a city,\nwhere shadowy passengers passed and repassed; where shadowy\ncarts and coaches battled for the way, and all the strife and\ntumult of a real city were. It was made plain enough, by\nthe dressing of the shops, that here too it was Christmas\ntime again; but it was evening, and the streets were\nlighted up.\n\nThe Ghost stopped at a certain warehouse door, and asked\nScrooge if he knew it.\n\n\"Know it!\" said Scrooge. \"Was I apprenticed here!\"\n\nThey went in. At sight of an old gentleman in a Welsh\nwig, sitting behind such a high desk, that if he had been two\ninches taller he must have knocked his head against the\nceiling, Scrooge cried in great excitement:\n\n\"Why, it's old Fezziwig! Bless his heart; it's Fezziwig\nalive again!\"\n\nOld Fezziwig laid down his pen, and looked up at the\nclock, which pointed to the hour of seven. He rubbed his\nhands; adjusted his capacious waistcoat; laughed all over\nhimself, from his shoes to his organ of benevolence; and\ncalled out in a comfortable, oily, rich, fat, jovial voice:\n\n\"Yo ho, there! Ebenezer! Dick!\"\n\nScrooge's former self, now grown a young man, came briskly\nin, accompanied by his fellow-'prentice.\n\n\"Dick Wilkins, to be sure!\" said Scrooge to the Ghost.\n\"Bless me, yes. There he is. He was very much attached\nto me, was Dick. Poor Dick! Dear, dear!\"\n\n\"Yo ho, my boys!\" said Fezziwig. \"No more work to-night.\nChristmas Eve, Dick. Christmas, Ebenezer! Let's\nhave the shutters up,\" cried old Fezziwig, with a sharp clap\nof his hands, \"before a man can say Jack Robinson!\"\n\nYou wouldn't believe how those two fellows went at it!\nThey charged into the street with the shutters--one, two,\nthree--had 'em up in their places--four, five, six--barred\n'em and pinned 'em--seven, eight, nine--and came back\nbefore you could have got to twelve, panting like race-horses.\n\n\"Hilli-ho!\" cried old Fezziwig, skipping down from the\nhigh desk, with wonderful agility. \"Clear away, my lads,\nand let's have lots of room here! Hilli-ho, Dick! Chirrup,\nEbenezer!\"\n\nClear away! There was nothing they wouldn't have cleared\naway, or couldn't have cleared away, with old Fezziwig looking\non. It was done in a minute. Every movable was packed off, as if\nit were dismissed from public life for evermore; the floor was\nswept and watered, the lamps were trimmed, fuel was heaped upon\nthe fire; and the warehouse was as snug, and warm, and dry, and\nbright a ball-room, as you would desire to see upon a winter's\nnight.\n\nIn came a fiddler with a music-book, and went up to the\nlofty desk, and made an orchestra of it, and tuned like fifty\nstomach-aches. In came Mrs. Fezziwig, one vast substantial\nsmile. In came the three Miss Fezziwigs, beaming and\nlovable. In came the six young followers whose hearts they\nbroke. In came all the young men and women employed in\nthe business. In came the housemaid, with her cousin, the\nbaker. In came the cook, with her brother's particular friend,\nthe milkman. In came the boy from over the way, who was\nsuspected of not having board enough from his master; trying\nto hide himself behind the girl from next door but one, who\nwas proved to have had her ears pulled by her mistress.\nIn they all came, one after another; some shyly, some boldly,\nsome gracefully, some awkwardly, some pushing, some pulling;\nin they all came, anyhow and everyhow. Away they all went,\ntwenty couple at once; hands half round and back again\nthe other way; down the middle and up again; round\nand round in various stages of affectionate grouping; old\ntop couple always turning up in the wrong place; new top\ncouple starting off again, as soon as they got there; all top\ncouples at last, and not a bottom one to help them! When\nthis result was brought about, old Fezziwig, clapping his\nhands to stop the dance, cried out, \"Well done!\" and the\nfiddler plunged his hot face into a pot of porter, especially\nprovided for that purpose. But scorning rest, upon his\nreappearance, he instantly began again, though there were no\ndancers yet, as if the other fiddler had been carried home,\nexhausted, on a shutter, and he were a bran-new man\nresolved to beat him out of sight, or perish.\n\nThere were more dances, and there were forfeits, and more\ndances, and there was cake, and there was negus, and there\nwas a great piece of Cold Roast, and there was a great piece\nof Cold Boiled, and there were mince-pies, and plenty of beer.\nBut the great effect of the evening came after the Roast\nand Boiled, when the fiddler (an artful dog, mind! The sort\nof man who knew his business better than you or I could\nhave told it him!) struck up \"Sir Roger de Coverley.\"  Then\nold Fezziwig stood out to dance with Mrs. Fezziwig. Top\ncouple, too; with a good stiff piece of work cut out for them;\nthree or four and twenty pair of partners; people who were\nnot to be trifled with; people who would dance, and had no\nnotion of walking.\n\nBut if they had been twice as many--ah, four times--old\nFezziwig would have been a match for them, and so would\nMrs. Fezziwig. As to her, she was worthy to be his partner\nin every sense of the term. If that's not high praise, tell me\nhigher, and I'll use it. A positive light appeared to issue\nfrom Fezziwig's calves. They shone in every part of the\ndance like moons. You couldn't have predicted, at any given\ntime, what would have become of them next. And when old\nFezziwig and Mrs. Fezziwig had gone all through the dance;\nadvance and retire, both hands to your partner, bow and\ncurtsey, corkscrew, thread-the-needle, and back again to\nyour place; Fezziwig \"cut\"--cut so deftly, that he appeared\nto wink with his legs, and came upon his feet again without\na stagger.\n\nWhen the clock struck eleven, this domestic ball broke up.\nMr. and Mrs. Fezziwig took their stations, one on either side\nof the door, and shaking hands with every person individually\nas he or she went out, wished him or her a Merry Christmas.\nWhen everybody had retired but the two 'prentices, they did\nthe same to them; and thus the cheerful voices died away,\nand the lads were left to their beds; which were under a\ncounter in the back-shop.\n\nDuring the whole of this time, Scrooge had acted like a\nman out of his wits. His heart and soul were in the scene,\nand with his former self. He corroborated everything,\nremembered everything, enjoyed everything, and underwent\nthe strangest agitation. It was not until now, when the\nbright faces of his former self and Dick were turned from\nthem, that he remembered the Ghost, and became conscious\nthat it was looking full upon him, while the light upon its\nhead burnt very clear.\n\n\"A small matter,\" said the Ghost, \"to make these silly\nfolks so full of gratitude.\"\n\n\"Small!\" echoed Scrooge.\n\nThe Spirit signed to him to listen to the two apprentices,\nwho were pouring out their hearts in praise of Fezziwig:\nand when he had done so, said,\n\n\"Why! Is it not? He has spent but a few pounds of\nyour mortal money: three or four perhaps. Is that so\nmuch that he deserves this praise?\"\n\n\"It isn't that,\" said Scrooge, heated by the remark, and\nspeaking unconsciously like his former, not his latter, self.\n\"It isn't that, Spirit. He has the power to render us happy\nor unhappy; to make our service light or burdensome; a\npleasure or a toil. Say that his power lies in words and\nlooks; in things so slight and insignificant that it is\nimpossible to add and count 'em up: what then? The happiness\nhe gives, is quite as great as if it cost a fortune.\"\n\nHe felt the Spirit's glance, and stopped.\n\n\"What is the matter?\" asked the Ghost.\n\n\"Nothing particular,\" said Scrooge.\n\n\"Something, I think?\" the Ghost insisted.\n\n\"No,\" said Scrooge, \"No. I should like to be able to say\na word or two to my clerk just now. That's all.\"\n\nHis former self turned down the lamps as he gave utterance\nto the wish; and Scrooge and the Ghost again stood side by\nside in the open air.\n\n\"My time grows short,\" observed the Spirit. \"Quick!\"\n\nThis was not addressed to Scrooge, or to any one whom he\ncould see, but it produced an immediate effect. For again\nScrooge saw himself. He was older now; a man in the prime\nof life. His face had not the harsh and rigid lines of later\nyears; but it had begun to wear the signs of care and avarice.\nThere was an eager, greedy, restless motion in the eye, which\nshowed the passion that had taken root, and where the\nshadow of the growing tree would fall.\n\nHe was not alone, but sat by the side of a fair young\ngirl in a mourning-dress: in whose eyes there were tears,\nwhich sparkled in the light that shone out of the Ghost of\nChristmas Past.\n\n\"It matters little,\" she said, softly. \"To you, very little.\nAnother idol has displaced me; and if it can cheer and comfort\nyou in time to come, as I would have tried to do, I have\nno just cause to grieve.\"\n\n\"What Idol has displaced you?\" he rejoined.\n\n\"A golden one.\"\n\n\"This is the even-handed dealing of the world!\" he said.\n\"There is nothing on which it is so hard as poverty; and\nthere is nothing it professes to condemn with such severity\nas the pursuit of wealth!\"\n\n\"You fear the world too much,\" she answered, gently.\n\"All your other hopes have merged into the hope of being\nbeyond the chance of its sordid reproach. I have seen your\nnobler aspirations fall off one by one, until the master-passion,\nGain, engrosses you. Have I not?\"\n\n\"What then?\" he retorted. \"Even if I have grown so\nmuch wiser, what then? I am not changed towards you.\"\n\nShe shook her head.\n\n\"Am I?\"\n\n\"Our contract is an old one. It was made when we were\nboth poor and content to be so, until, in good season, we could\nimprove our worldly fortune by our patient industry. You\nare changed. When it was made, you were another man.\"\n\n\"I was a boy,\" he said impatiently.\n\n\"Your own feeling tells you that you were not what you\nare,\" she returned. \"I am. That which promised happiness\nwhen we were one in heart, is fraught with misery now that\nwe are two. How often and how keenly I have thought of\nthis, I will not say. It is enough that I have thought of it,\nand can release you.\"\n\n\"Have I ever sought release?\"\n\n\"In words. No. Never.\"\n\n\"In what, then?\"\n\n\"In a changed nature; in an altered spirit; in another\natmosphere of life; another Hope as its great end. In\neverything that made my love of any worth or value in your\nsight. If this had never been between us,\" said the girl,\nlooking mildly, but with steadiness, upon him; \"tell me,\nwould you seek me out and try to win me now? Ah, no!\"\n\nHe seemed to yield to the justice of this supposition, in\nspite of himself. But he said with a struggle, \"You think\nnot.\"\n\n\"I would gladly think otherwise if I could,\" she answered,\n\"Heaven knows! When I have learned a Truth like this,\nI know how strong and irresistible it must be. But if you\nwere free to-day, to-morrow, yesterday, can even I believe\nthat you would choose a dowerless girl--you who, in your\nvery confidence with her, weigh everything by Gain: or,\nchoosing her, if for a moment you were false enough to your\none guiding principle to do so, do I not know that your\nrepentance and regret would surely follow? I do; and I\nrelease you. With a full heart, for the love of him you\nonce were.\"\n\nHe was about to speak; but with her head turned from\nhim, she resumed.\n\n\"You may--the memory of what is past half makes me\nhope you will--have pain in this. A very, very brief time,\nand you will dismiss the recollection of it, gladly, as an\nunprofitable dream, from which it happened well that you\nawoke. May you be happy in the life you have chosen!\"\n\nShe left him, and they parted.\n\n\"Spirit!\" said Scrooge, \"show me no more! Conduct\nme home. Why do you delight to torture me?\"\n\n\"One shadow more!\" exclaimed the Ghost.\n\n\"No more!\" cried Scrooge. \"No more. I don't wish to\nsee it. Show me no more!\"\n\nBut the relentless Ghost pinioned him in both his arms,\nand forced him to observe what happened next.\n\nThey were in another scene and place; a room, not very\nlarge or handsome, but full of comfort. Near to the winter\nfire sat a beautiful young girl, so like that last that Scrooge\nbelieved it was the same, until he saw her, now a comely\nmatron, sitting opposite her daughter. The noise in this\nroom was perfectly tumultuous, for there were more children\nthere, than Scrooge in his agitated state of mind could count;\nand, unlike the celebrated herd in the poem, they were not\nforty children conducting themselves like one, but every\nchild was conducting itself like forty. The consequences\nwere uproarious beyond belief; but no one seemed to care;\non the contrary, the mother and daughter laughed heartily,\nand enjoyed it very much; and the latter, soon beginning to\nmingle in the sports, got pillaged by the young brigands\nmost ruthlessly. What would I not have given to be one of\nthem! Though I never could have been so rude, no, no! I\nwouldn't for the wealth of all the world have crushed that\nbraided hair, and torn it down; and for the precious little\nshoe, I wouldn't have plucked it off, God bless my soul! to\nsave my life. As to measuring her waist in sport, as they\ndid, bold young brood, I couldn't have done it; I should\nhave expected my arm to have grown round it for a punishment,\nand never come straight again. And yet I should\nhave dearly liked, I own, to have touched her lips; to have\nquestioned her, that she might have opened them; to have\nlooked upon the lashes of her downcast eyes, and never\nraised a blush; to have let loose waves of hair, an inch of\nwhich would be a keepsake beyond price: in short, I should\nhave liked, I do confess, to have had the lightest licence\nof a child, and yet to have been man enough to know its\nvalue.\n\nBut now a knocking at the door was heard, and such a\nrush immediately ensued that she with laughing face and\nplundered dress was borne towards it the centre of a flushed\nand boisterous group, just in time to greet the father, who\ncame home attended by a man laden with Christmas toys\nand presents. Then the shouting and the struggling, and\nthe onslaught that was made on the defenceless porter!\nThe scaling him with chairs for ladders to dive into his\npockets, despoil him of brown-paper parcels, hold on tight\nby his cravat, hug him round his neck, pommel his back,\nand kick his legs in irrepressible affection! The shouts of\nwonder and delight with which the development of every\npackage was received! The terrible announcement that the\nbaby had been taken in the act of putting a doll's frying-pan\ninto his mouth, and was more than suspected of having\nswallowed a fictitious turkey, glued on a wooden platter!\nThe immense relief of finding this a false alarm! The joy,\nand gratitude, and ecstasy! They are all indescribable alike.\nIt is enough that by degrees the children and their emotions\ngot out of the parlour, and by one stair at a time, up to the\ntop of the house; where they went to bed, and so subsided.\n\nAnd now Scrooge looked on more attentively than ever,\nwhen the master of the house, having his daughter leaning\nfondly on him, sat down with her and her mother at his\nown fireside; and when he thought that such another\ncreature, quite as graceful and as full of promise, might\nhave called him father, and been a spring-time in the\nhaggard winter of his life, his sight grew very dim indeed.\n\n\"Belle,\" said the husband, turning to his wife with a\nsmile, \"I saw an old friend of yours this afternoon.\"\n\n\"Who was it?\"\n\n\"Guess!\"\n\n\"How can I? Tut, don't I know?\" she added in the\nsame breath, laughing as he laughed. \"Mr. Scrooge.\"\n\n\"Mr. Scrooge it was. I passed his office window; and as\nit was not shut up, and he had a candle inside, I could\nscarcely help seeing him. His partner lies upon the point\nof death, I hear; and there he sat alone. Quite alone in\nthe world, I do believe.\"\n\n\"Spirit!\" said Scrooge in a broken voice, \"remove me\nfrom this place.\"\n\n\"I told you these were shadows of the things that have\nbeen,\" said the Ghost. \"That they are what they are, do\nnot blame me!\"\n\n\"Remove me!\" Scrooge exclaimed, \"I cannot bear it!\"\n\nHe turned upon the Ghost, and seeing that it looked upon\nhim with a face, in which in some strange way there were\nfragments of all the faces it had shown him, wrestled with it.\n\n\"Leave me! Take me back. Haunt me no longer!\"\n\nIn the struggle, if that can be called a struggle in which\nthe Ghost with no visible resistance on its own part was\nundisturbed by any effort of its adversary, Scrooge observed\nthat its light was burning high and bright; and dimly\nconnecting that with its influence over him, he seized the\nextinguisher-cap, and by a sudden action pressed it down\nupon its head.\n\nThe Spirit dropped beneath it, so that the extinguisher\ncovered its whole form; but though Scrooge pressed it down\nwith all his force, he could not hide the light: which streamed\nfrom under it, in an unbroken flood upon the ground.\n\nHe was conscious of being exhausted, and overcome by an\nirresistible drowsiness; and, further, of being in his own\nbedroom.  He gave the cap a parting squeeze, in which his hand\nrelaxed; and had barely time to reel to bed, before he sank\ninto a heavy sleep.\n\n\nSTAVE III:  THE SECOND OF THE THREE SPIRITS\n\nAWAKING in the middle of a prodigiously tough snore, and\nsitting up in bed to get his thoughts together, Scrooge had\nno occasion to be told that the bell was again upon the\nstroke of One. He felt that he was restored to consciousness\nin the right nick of time, for the especial purpose of holding\na conference with the second messenger despatched to him\nthrough Jacob Marley's intervention. But finding that he\nturned uncomfortably cold when he began to wonder which\nof his curtains this new spectre would draw back, he put\nthem every one aside with his own hands; and lying down\nagain, established a sharp look-out all round the bed. For\nhe wished to challenge the Spirit on the moment of its\nappearance, and did not wish to be taken by surprise, and\nmade nervous.\n\nGentlemen of the free-and-easy sort, who plume themselves\non being acquainted with a move or two, and being usually\nequal to the time-of-day, express the wide range of their\ncapacity for adventure by observing that they are good for\nanything from pitch-and-toss to manslaughter; between which\nopposite extremes, no doubt, there lies a tolerably wide and\ncomprehensive range of subjects. Without venturing for\nScrooge quite as hardily as this, I don't mind calling on you\nto believe that he was ready for a good broad field of\nstrange appearances, and that nothing between a baby and\nrhinoceros would have astonished him very much.\n\nNow, being prepared for almost anything, he was not by\nany means prepared for nothing; and, consequently, when the\nBell struck One, and no shape appeared, he was taken with a\nviolent fit of trembling. Five minutes, ten minutes, a quarter\nof an hour went by, yet nothing came. All this time, he lay\nupon his bed, the very core and centre of a blaze of ruddy\nlight, which streamed upon it when the clock proclaimed the\nhour; and which, being only light, was more alarming than\na dozen ghosts, as he was powerless to make out what it\nmeant, or would be at; and was sometimes apprehensive\nthat he might be at that very moment an interesting case of\nspontaneous combustion, without having the consolation of\nknowing it. At last, however, he began to think--as you or\nI would have thought at first; for it is always the person not\nin the predicament who knows what ought to have been done\nin it, and would unquestionably have done it too--at last, I\nsay, he began to think that the source and secret of this\nghostly light might be in the adjoining room, from whence,\non further tracing it, it seemed to shine. This idea taking\nfull possession of his mind, he got up softly and shuffled in\nhis slippers to the door.\n\nThe moment Scrooge's hand was on the lock, a strange\nvoice called him by his name, and bade him enter. He\nobeyed.\n\nIt was his own room. There was no doubt about that.\nBut it had undergone a surprising transformation. The walls\nand ceiling were so hung with living green, that it looked a\nperfect grove; from every part of which, bright gleaming\nberries glistened. The crisp leaves of holly, mistletoe, and\nivy reflected back the light, as if so many little mirrors had\nbeen scattered there; and such a mighty blaze went roaring\nup the chimney, as that dull petrification of a hearth had\nnever known in Scrooge's time, or Marley's, or for many and\nmany a winter season gone. Heaped up on the floor, to form\na kind of throne, were turkeys, geese, game, poultry, brawn,\ngreat joints of meat, sucking-pigs, long wreaths of sausages,\nmince-pies, plum-puddings, barrels of oysters, red-hot chestnuts,\ncherry-cheeked apples, juicy oranges, luscious pears,\nimmense twelfth-cakes, and seething bowls of punch, that\nmade the chamber dim with their delicious steam. In easy\nstate upon this couch, there sat a jolly Giant, glorious to\nsee; who bore a glowing torch, in shape not unlike Plenty's\nhorn, and held it up, high up, to shed its light on Scrooge,\nas he came peeping round the door.\n\n\"Come in!\" exclaimed the Ghost. \"Come in! and know\nme better, man!\"\n\nScrooge entered timidly, and hung his head before this\nSpirit. He was not the dogged Scrooge he had been; and\nthough the Spirit's eyes were clear and kind, he did not like\nto meet them.\n\n\"I am the Ghost of Christmas Present,\" said the Spirit.\n\"Look upon me!\"\n\nScrooge reverently did so. It was clothed in one simple\ngreen robe, or mantle, bordered with white fur. This garment\nhung so loosely on the figure, that its capacious breast was\nbare, as if disdaining to be warded or concealed by any\nartifice. Its feet, observable beneath the ample folds of the\ngarment, were also bare; and on its head it wore no other\ncovering than a holly wreath, set here and there with shining\nicicles. Its dark brown curls were long and free; free as its\ngenial face, its sparkling eye, its open hand, its cheery voice,\nits unconstrained demeanour, and its joyful air. Girded\nround its middle was an antique scabbard; but no sword\nwas in it, and the ancient sheath was eaten up with rust.\n\n\"You have never seen the like of me before!\" exclaimed\nthe Spirit.\n\n\"Never,\" Scrooge made answer to it.\n\n\"Have never walked forth with the younger members of\nmy family; meaning (for I am very young) my elder brothers\nborn in these later years?\" pursued the Phantom.\n\n\"I don't think I have,\" said Scrooge. \"I am afraid I have\nnot. Have you had many brothers, Spirit?\"\n\n\"More than eighteen hundred,\" said the Ghost.\n\n\"A tremendous family to provide for!\" muttered Scrooge.\n\nThe Ghost of Christmas Present rose.\n\n\"Spirit,\" said Scrooge submissively, \"conduct me where\nyou will. I went forth last night on compulsion, and I learnt\na lesson which is working now. To-night, if you have aught\nto teach me, let me profit by it.\"\n\n\"Touch my robe!\"\n\nScrooge did as he was told, and held it fast.\n\nHolly, mistletoe, red berries, ivy, turkeys, geese, game,\npoultry, brawn, meat, pigs, sausages, oysters, pies, puddings,\nfruit, and punch, all vanished instantly. So did the room,\nthe fire, the ruddy glow, the hour of night, and they stood\nin the city streets on Christmas morning, where (for the\nweather was severe) the people made a rough, but brisk and\nnot unpleasant kind of music, in scraping the snow from the\npavement in front of their dwellings, and from the tops of\ntheir houses, whence it was mad delight to the boys to see\nit come plumping down into the road below, and splitting\ninto artificial little snow-storms.\n\nThe house fronts looked black enough, and the windows\nblacker, contrasting with the smooth white sheet of snow\nupon the roofs, and with the dirtier snow upon the ground;\nwhich last deposit had been ploughed up in deep furrows by\nthe heavy wheels of carts and waggons; furrows that crossed\nand re-crossed each other hundreds of times where the great\nstreets branched off; and made intricate channels, hard to trace\nin the thick yellow mud and icy water. The sky was gloomy,\nand the shortest streets were choked up with a dingy mist,\nhalf thawed, half frozen, whose heavier particles descended\nin a shower of sooty atoms, as if all the chimneys in Great\nBritain had, by one consent, caught fire, and were blazing away\nto their dear hearts' content. There was nothing very cheerful\nin the climate or the town, and yet was there an air of\ncheerfulness abroad that the clearest summer air and brightest\nsummer sun might have endeavoured to diffuse in vain.\n\nFor, the people who were shovelling away on the housetops\nwere jovial and full of glee; calling out to one another\nfrom the parapets, and now and then exchanging a facetious\nsnowball--better-natured missile far than many a wordy jest--\nlaughing heartily if it went right and not less heartily if it\nwent wrong. The poulterers' shops were still half open, and the\nfruiterers' were radiant in their glory. There were great, round,\npot-bellied baskets of chestnuts, shaped like the waistcoats\nof jolly old gentlemen, lolling at the doors, and tumbling out\ninto the street in their apoplectic opulence. There were\nruddy, brown-faced, broad-girthed Spanish Onions, shining in\nthe fatness of their growth like Spanish Friars, and winking\nfrom their shelves in wanton slyness at the girls as they went\nby, and glanced demurely at the hung-up mistletoe. There were\npears and apples, clustered high in blooming pyramids; there\nwere bunches of grapes, made, in the shopkeepers' benevolence\nto dangle from conspicuous hooks, that people's mouths might\nwater gratis as they passed; there were piles of filberts, mossy\nand brown, recalling, in their fragrance, ancient walks among\nthe woods, and pleasant shufflings ankle deep through withered\nleaves; there were Norfolk Biffins, squat and swarthy, setting\noff the yellow of the oranges and lemons, and, in the great\ncompactness of their juicy persons, urgently entreating and\nbeseeching to be carried home in paper bags and eaten after\ndinner. The very gold and silver fish, set forth among\nthese choice fruits in a bowl, though members of a dull and\nstagnant-blooded race, appeared to know that there was\nsomething going on; and, to a fish, went gasping round and\nround their little world in slow and passionless excitement.\n\nThe Grocers'! oh, the Grocers'! nearly closed, with perhaps\ntwo shutters down, or one; but through those gaps such\nglimpses! It was not alone that the scales descending on the\ncounter made a merry sound, or that the twine and roller\nparted company so briskly, or that the canisters were rattled\nup and down like juggling tricks, or even that the blended\nscents of tea and coffee were so grateful to the nose, or even\nthat the raisins were so plentiful and rare, the almonds so\nextremely white, the sticks of cinnamon so long and straight,\nthe other spices so delicious, the candied fruits so caked and\nspotted with molten sugar as to make the coldest lookers-on\nfeel faint and subsequently bilious. Nor was it that the figs\nwere moist and pulpy, or that the French plums blushed in\nmodest tartness from their highly-decorated boxes, or that\neverything was good to eat and in its Christmas dress; but\nthe customers were all so hurried and so eager in the hopeful\npromise of the day, that they tumbled up against each other\nat the door, crashing their wicker baskets wildly, and left\ntheir purchases upon the counter, and came running back to\nfetch them, and committed hundreds of the like mistakes, in\nthe best humour possible; while the Grocer and his people\nwere so frank and fresh that the polished hearts with which\nthey fastened their aprons behind might have been their own,\nworn outside for general inspection, and for Christmas daws\nto peck at if they chose.\n\nBut soon the steeples called good people all, to church and\nchapel, and away they came, flocking through the streets in\ntheir best clothes, and with their gayest faces. And at the\nsame time there emerged from scores of bye-streets, lanes, and\nnameless turnings, innumerable people, carrying their dinners\nto the bakers' shops. The sight of these poor revellers\nappeared to interest the Spirit very much, for he stood with\nScrooge beside him in a baker's doorway, and taking off the\ncovers as their bearers passed, sprinkled incense on their\ndinners from his torch. And it was a very uncommon kind\nof torch, for once or twice when there were angry words\nbetween some dinner-carriers who had jostled each other, he\nshed a few drops of water on them from it, and their good\nhumour was restored directly. For they said, it was a shame\nto quarrel upon Christmas Day. And so it was! God love\nit, so it was!\n\nIn time the bells ceased, and the bakers were shut up; and\nyet there was a genial shadowing forth of all these dinners\nand the progress of their cooking, in the thawed blotch of\nwet above each baker's oven; where the pavement smoked as\nif its stones were cooking too.\n\n\"Is there a peculiar flavour in what you sprinkle from\nyour torch?\" asked Scrooge.\n\n\"There is. My own.\"\n\n\"Would it apply to any kind of dinner on this day?\"\nasked Scrooge.\n\n\"To any kindly given. To a poor one most.\"\n\n\"Why to a poor one most?\" asked Scrooge.\n\n\"Because it needs it most.\"\n\n\"Spirit,\" said Scrooge, after a moment's thought, \"I wonder\nyou, of all the beings in the many worlds about us, should\ndesire to cramp these people's opportunities of innocent\nenjoyment.\"\n\n\"I!\" cried the Spirit.\n\n\"You would deprive them of their means of dining every\nseventh day, often the only day on which they can be said\nto dine at all,\" said Scrooge. \"Wouldn't you?\"\n\n\"I!\" cried the Spirit.\n\n\"You seek to close these places on the Seventh Day?\" said\nScrooge. \"And it comes to the same thing.\"\n\n\"I seek!\" exclaimed the Spirit.\n\n\"Forgive me if I am wrong. It has been done in your\nname, or at least in that of your family,\" said Scrooge.\n\n\"There are some upon this earth of yours,\" returned the Spirit,\n\"who lay claim to know us, and who do their deeds of passion,\npride, ill-will, hatred, envy, bigotry, and selfishness\nin our name, who are as strange to us and all our kith and\nkin, as if they had never lived. Remember that, and charge\ntheir doings on themselves, not us.\"\n\nScrooge promised that he would; and they went on,\ninvisible, as they had been before, into the suburbs of the\ntown. It was a remarkable quality of the Ghost (which\nScrooge had observed at the baker's), that notwithstanding\nhis gigantic size, he could accommodate himself to any place\nwith ease; and that he stood beneath a low roof quite as\ngracefully and like a supernatural creature, as it was possible\nhe could have done in any lofty hall.\n\nAnd perhaps it was the pleasure the good Spirit had in\nshowing off this power of his, or else it was his own kind,\ngenerous, hearty nature, and his sympathy with all poor\nmen, that led him straight to Scrooge's clerk's; for there he\nwent, and took Scrooge with him, holding to his robe; and\non the threshold of the door the Spirit smiled, and stopped\nto bless Bob Cratchit's dwelling with the sprinkling of his\ntorch. Think of that! Bob had but fifteen \"Bob\" a-week\nhimself; he pocketed on Saturdays but fifteen copies of his\nChristian name; and yet the Ghost of Christmas Present\nblessed his four-roomed house!\n\nThen up rose Mrs. Cratchit, Cratchit's wife, dressed out\nbut poorly in a twice-turned gown, but brave in ribbons,\nwhich are cheap and make a goodly show for sixpence; and\nshe laid the cloth, assisted by Belinda Cratchit, second of\nher daughters, also brave in ribbons; while Master Peter\nCratchit plunged a fork into the saucepan of potatoes, and\ngetting the corners of his monstrous shirt collar (Bob's private\nproperty, conferred upon his son and heir in honour of the\nday) into his mouth, rejoiced to find himself so gallantly\nattired, and yearned to show his linen in the fashionable Parks.\nAnd now two smaller Cratchits, boy and girl, came tearing\nin, screaming that outside the baker's they had smelt the\ngoose, and known it for their own; and basking in luxurious\nthoughts of sage and onion, these young Cratchits danced\nabout the table, and exalted Master Peter Cratchit to the\nskies, while he (not proud, although his collars nearly choked\nhim) blew the fire, until the slow potatoes bubbling up,\nknocked loudly at the saucepan-lid to be let out and\npeeled.\n\n\"What has ever got your precious father then?\" said Mrs.\nCratchit. \"And your brother, Tiny Tim! And Martha\nwarn't as late last Christmas Day by half-an-hour?\"\n\n\"Here's Martha, mother!\" said a girl, appearing as she\nspoke.\n\n\"Here's Martha, mother!\" cried the two young Cratchits.\n\"Hurrah! There's such a goose, Martha!\"\n\n\"Why, bless your heart alive, my dear, how late you are!\"\nsaid Mrs. Cratchit, kissing her a dozen times, and taking off\nher shawl and bonnet for her with officious zeal.\n\n\"We'd a deal of work to finish up last night,\" replied the\ngirl, \"and had to clear away this morning, mother!\"\n\n\"Well! Never mind so long as you are come,\" said Mrs.\nCratchit. \"Sit ye down before the fire, my dear, and have\na warm, Lord bless ye!\"\n\n\"No, no! There's father coming,\" cried the two young\nCratchits, who were everywhere at once. \"Hide, Martha,\nhide!\"\n\nSo Martha hid herself, and in came little Bob, the father,\nwith at least three feet of comforter exclusive of the fringe,\nhanging down before him; and his threadbare clothes darned\nup and brushed, to look seasonable; and Tiny Tim upon his\nshoulder. Alas for Tiny Tim, he bore a little crutch, and\nhad his limbs supported by an iron frame!\n\n\"Why, where's our Martha?\" cried Bob Cratchit, looking\nround.\n\n\"Not coming,\" said Mrs. Cratchit.\n\n\"Not coming!\" said Bob, with a sudden declension in his\nhigh spirits; for he had been Tim's blood horse all the way\nfrom church, and had come home rampant. \"Not coming\nupon Christmas Day!\"\n\nMartha didn't like to see him disappointed, if it were only\nin joke; so she came out prematurely from behind the closet\ndoor, and ran into his arms, while the two young Cratchits\nhustled Tiny Tim, and bore him off into the wash-house,\nthat he might hear the pudding singing in the copper.\n\n\"And how did little Tim behave?\" asked Mrs. Cratchit,\nwhen she had rallied Bob on his credulity, and Bob had\nhugged his daughter to his heart's content.\n\n\"As good as gold,\" said Bob, \"and better. Somehow he\ngets thoughtful, sitting by himself so much, and thinks the\nstrangest things you ever heard. He told me, coming home,\nthat he hoped the people saw him in the church, because he\nwas a cripple, and it might be pleasant to them to remember\nupon Christmas Day, who made lame beggars walk, and blind\nmen see.\"\n\nBob's voice was tremulous when he told them this, and\ntrembled more when he said that Tiny Tim was growing\nstrong and hearty.\n\nHis active little crutch was heard upon the floor, and back\ncame Tiny Tim before another word was spoken, escorted by\nhis brother and sister to his stool before the fire; and while\nBob, turning up his cuffs--as if, poor fellow, they were\ncapable of being made more shabby--compounded some hot\nmixture in a jug with gin and lemons, and stirred it round\nand round and put it on the hob to simmer; Master Peter,\nand the two ubiquitous young Cratchits went to fetch the\ngoose, with which they soon returned in high procession.\n\nSuch a bustle ensued that you might have thought a goose\nthe rarest of all birds; a feathered phenomenon, to which a\nblack swan was a matter of course--and in truth it was\nsomething very like it in that house. Mrs. Cratchit made\nthe gravy (ready beforehand in a little saucepan) hissing hot;\nMaster Peter mashed the potatoes with incredible vigour;\nMiss Belinda sweetened up the apple-sauce; Martha dusted\nthe hot plates; Bob took Tiny Tim beside him in a tiny\ncorner at the table; the two young Cratchits set chairs for\neverybody, not forgetting themselves, and mounting guard\nupon their posts, crammed spoons into their mouths, lest\nthey should shriek for goose before their turn came to be\nhelped. At last the dishes were set on, and grace was\nsaid. It was succeeded by a breathless pause, as Mrs.\nCratchit, looking slowly all along the carving-knife, prepared\nto plunge it in the breast; but when she did, and when the\nlong expected gush of stuffing issued forth, one murmur of\ndelight arose all round the board, and even Tiny Tim,\nexcited by the two young Cratchits, beat on the table with\nthe handle of his knife, and feebly cried Hurrah!\n\nThere never was such a goose. Bob said he didn't believe\nthere ever was such a goose cooked. Its tenderness and\nflavour, size and cheapness, were the themes of universal\nadmiration. Eked out by apple-sauce and mashed potatoes,\nit was a sufficient dinner for the whole family; indeed, as\nMrs. Cratchit said with great delight (surveying one small\natom of a bone upon the dish), they hadn't ate it all at\nlast! Yet every one had had enough, and the youngest\nCratchits in particular, were steeped in sage and onion to\nthe eyebrows! But now, the plates being changed by Miss\nBelinda, Mrs. Cratchit left the room alone--too nervous to\nbear witnesses--to take the pudding up and bring it in.\n\nSuppose it should not be done enough! Suppose it should\nbreak in turning out! Suppose somebody should have got\nover the wall of the back-yard, and stolen it, while they\nwere merry with the goose--a supposition at which the two\nyoung Cratchits became livid! All sorts of horrors were\nsupposed.\n\nHallo! A great deal of steam! The pudding was out of\nthe copper. A smell like a washing-day! That was the\ncloth. A smell like an eating-house and a pastrycook's next\ndoor to each other, with a laundress's next door to that!\nThat was the pudding! In half a minute Mrs. Cratchit\nentered--flushed, but smiling proudly--with the pudding,\nlike a speckled cannon-ball, so hard and firm, blazing in half\nof half-a-quartern of ignited brandy, and bedight with\nChristmas holly stuck into the top.\n\nOh, a wonderful pudding! Bob Cratchit said, and calmly\ntoo, that he regarded it as the greatest success achieved by\nMrs. Cratchit since their marriage. Mrs. Cratchit said that\nnow the weight was off her mind, she would confess she had\nhad her doubts about the quantity of flour. Everybody had\nsomething to say about it, but nobody said or thought it\nwas at all a small pudding for a large family. It would have\nbeen flat heresy to do so. Any Cratchit would have blushed\nto hint at such a thing.\n\nAt last the dinner was all done, the cloth was cleared, the\nhearth swept, and the fire made up. The compound in the\njug being tasted, and considered perfect, apples and oranges\nwere put upon the table, and a shovel-full of chestnuts on the\nfire. Then all the Cratchit family drew round the hearth, in\nwhat Bob Cratchit called a circle, meaning half a one; and\nat Bob Cratchit's elbow stood the family display of glass.\nTwo tumblers, and a custard-cup without a handle.\n\nThese held the hot stuff from the jug, however, as well as\ngolden goblets would have done; and Bob served it out with\nbeaming looks, while the chestnuts on the fire sputtered and\ncracked noisily. Then Bob proposed:\n\n\"A Merry Christmas to us all, my dears. God bless us!\"\n\nWhich all the family re-echoed.\n\n\"God bless us every one!\" said Tiny Tim, the last of all.\n\nHe sat very close to his father's side upon his little\nstool. Bob held his withered little hand in his, as if he\nloved the child, and wished to keep him by his side, and\ndreaded that he might be taken from him.\n\n\"Spirit,\" said Scrooge, with an interest he had never felt\nbefore, \"tell me if Tiny Tim will live.\"\n\n\"I see a vacant seat,\" replied the Ghost, \"in the poor\nchimney-corner, and a crutch without an owner, carefully\npreserved. If these shadows remain unaltered by the Future,\nthe child will die.\"\n\n\"No, no,\" said Scrooge. \"Oh, no, kind Spirit! say he\nwill be spared.\"\n\n\"If these shadows remain unaltered by the Future, none\nother of my race,\" returned the Ghost, \"will find him here.\nWhat then? If he be like to die, he had better do it, and\ndecrease the surplus population.\"\n\nScrooge hung his head to hear his own words quoted by\nthe Spirit, and was overcome with penitence and grief.\n\n\"Man,\" said the Ghost, \"if man you be in heart, not\nadamant, forbear that wicked cant until you have discovered\nWhat the surplus is, and Where it is. Will you decide what\nmen shall live, what men shall die? It may be, that in the\nsight of Heaven, you are more worthless and less fit to live\nthan millions like this poor man's child. Oh God! to hear\nthe Insect on the leaf pronouncing on the too much life\namong his hungry brothers in the dust!\"\n\nScrooge bent before the Ghost's rebuke, and trembling cast\nhis eyes upon the ground. But he raised them speedily, on\nhearing his own name.\n\n\"Mr. Scrooge!\" said Bob; \"I'll give you Mr. Scrooge, the\nFounder of the Feast!\"\n\n\"The Founder of the Feast indeed!\" cried Mrs. Cratchit,\nreddening. \"I wish I had him here. I'd give him a piece\nof my mind to feast upon, and I hope he'd have a good\nappetite for it.\"\n\n\"My dear,\" said Bob, \"the children! Christmas Day.\"\n\n\"It should be Christmas Day, I am sure,\" said she, \"on\nwhich one drinks the health of such an odious, stingy, hard,\nunfeeling man as Mr. Scrooge. You know he is, Robert!\nNobody knows it better than you do, poor fellow!\"\n\n\"My dear,\" was Bob's mild answer, \"Christmas Day.\"\n\n\"I'll drink his health for your sake and the Day's,\" said\nMrs. Cratchit, \"not for his. Long life to him! A merry\nChristmas and a happy new year! He'll be very merry and\nvery happy, I have no doubt!\"\n\nThe children drank the toast after her. It was the first of\ntheir proceedings which had no heartiness. Tiny Tim drank\nit last of all, but he didn't care twopence for it. Scrooge\nwas the Ogre of the family. The mention of his name cast\na dark shadow on the party, which was not dispelled for full\nfive minutes.\n\nAfter it had passed away, they were ten times merrier than\nbefore, from the mere relief of Scrooge the Baleful being done\nwith. Bob Cratchit told them how he had a situation in his\neye for Master Peter, which would bring in, if obtained, full\nfive-and-sixpence weekly. The two young Cratchits laughed\ntremendously at the idea of Peter's being a man of business;\nand Peter himself looked thoughtfully at the fire from\nbetween his collars, as if he were deliberating what particular\ninvestments he should favour when he came into the receipt\nof that bewildering income. Martha, who was a poor\napprentice at a milliner's, then told them what kind of work\nshe had to do, and how many hours she worked at a stretch,\nand how she meant to lie abed to-morrow morning for a\ngood long rest; to-morrow being a holiday she passed at\nhome. Also how she had seen a countess and a lord some\ndays before, and how the lord \"was much about as tall as\nPeter;\" at which Peter pulled up his collars so high that you\ncouldn't have seen his head if you had been there. All this\ntime the chestnuts and the jug went round and round; and\nby-and-bye they had a song, about a lost child travelling in\nthe snow, from Tiny Tim, who had a plaintive little voice,\nand sang it very well indeed.\n\nThere was nothing of high mark in this. They were not\na handsome family; they were not well dressed; their shoes\nwere far from being water-proof; their clothes were scanty;\nand Peter might have known, and very likely did, the inside\nof a pawnbroker's. But, they were happy, grateful, pleased\nwith one another, and contented with the time; and when\nthey faded, and looked happier yet in the bright sprinklings\nof the Spirit's torch at parting, Scrooge had his eye upon\nthem, and especially on Tiny Tim, until the last.\n\nBy this time it was getting dark, and snowing pretty\nheavily; and as Scrooge and the Spirit went along the streets,\nthe brightness of the roaring fires in kitchens, parlours, and\nall sorts of rooms, was wonderful. Here, the flickering of\nthe blaze showed preparations for a cosy dinner, with hot\nplates baking through and through before the fire, and deep\nred curtains, ready to be drawn to shut out cold and darkness.\nThere all the children of the house were running out\ninto the snow to meet their married sisters, brothers, cousins,\nuncles, aunts, and be the first to greet them. Here, again,\nwere shadows on the window-blind of guests assembling; and\nthere a group of handsome girls, all hooded and fur-booted,\nand all chattering at once, tripped lightly off to some near\nneighbour's house; where, woe upon the single man who saw\nthem enter--artful witches, well they knew it--in a glow!\n\nBut, if you had judged from the numbers of people on\ntheir way to friendly gatherings, you might have thought\nthat no one was at home to give them welcome when they\ngot there, instead of every house expecting company, and\npiling up its fires half-chimney high. Blessings on it, how\nthe Ghost exulted! How it bared its breadth of breast, and\nopened its capacious palm, and floated on, outpouring, with\na generous hand, its bright and harmless mirth on everything\nwithin its reach! The very lamplighter, who ran on before,\ndotting the dusky street with specks of light, and who was\ndressed to spend the evening somewhere, laughed out loudly\nas the Spirit passed, though little kenned the lamplighter\nthat he had any company but Christmas!\n\nAnd now, without a word of warning from the Ghost, they\nstood upon a bleak and desert moor, where monstrous masses\nof rude stone were cast about, as though it were the burial-place\nof giants; and water spread itself wheresoever it listed,\nor would have done so, but for the frost that held it prisoner;\nand nothing grew but moss and furze, and coarse rank grass.\nDown in the west the setting sun had left a streak of fiery\nred, which glared upon the desolation for an instant, like a\nsullen eye, and frowning lower, lower, lower yet, was lost in\nthe thick gloom of darkest night.\n\n\"What place is this?\" asked Scrooge.\n\n\"A place where Miners live, who labour in the bowels of\nthe earth,\" returned the Spirit. \"But they know me. See!\"\n\nA light shone from the window of a hut, and swiftly they\nadvanced towards it. Passing through the wall of mud and\nstone, they found a cheerful company assembled round a\nglowing fire. An old, old man and woman, with their\nchildren and their children's children, and another generation\nbeyond that, all decked out gaily in their holiday attire.\nThe old man, in a voice that seldom rose above the howling\nof the wind upon the barren waste, was singing them a\nChristmas song--it had been a very old song when he was a\nboy--and from time to time they all joined in the chorus.\nSo surely as they raised their voices, the old man got quite\nblithe and loud; and so surely as they stopped, his vigour\nsank again.\n\nThe Spirit did not tarry here, but bade Scrooge hold his\nrobe, and passing on above the moor, sped--whither? Not\nto sea? To sea. To Scrooge's horror, looking back, he saw\nthe last of the land, a frightful range of rocks, behind them;\nand his ears were deafened by the thundering of water, as it\nrolled and roared, and raged among the dreadful caverns it\nhad worn, and fiercely tried to undermine the earth.\n\nBuilt upon a dismal reef of sunken rocks, some league\nor so from shore, on which the waters chafed and dashed,\nthe wild year through, there stood a solitary lighthouse.\nGreat heaps of sea-weed clung to its base, and storm-birds\n--born of the wind one might suppose, as sea-weed of the\nwater--rose and fell about it, like the waves they skimmed.\n\nBut even here, two men who watched the light had made\na fire, that through the loophole in the thick stone wall shed\nout a ray of brightness on the awful sea. Joining their\nhorny hands over the rough table at which they sat, they\nwished each other Merry Christmas in their can of grog; and\none of them: the elder, too, with his face all damaged and\nscarred with hard weather, as the figure-head of an old ship\nmight be: struck up a sturdy song that was like a Gale in\nitself.\n\nAgain the Ghost sped on, above the black and heaving sea\n--on, on--until, being far away, as he told Scrooge, from any\nshore, they lighted on a ship. They stood beside the helmsman\nat the wheel, the look-out in the bow, the officers who\nhad the watch; dark, ghostly figures in their several stations;\nbut every man among them hummed a Christmas tune, or\nhad a Christmas thought, or spoke below his breath to his\ncompanion of some bygone Christmas Day, with homeward\nhopes belonging to it. And every man on board, waking or\nsleeping, good or bad, had had a kinder word for another\non that day than on any day in the year; and had shared\nto some extent in its festivities; and had remembered those\nhe cared for at a distance, and had known that they delighted\nto remember him.\n\nIt was a great surprise to Scrooge, while listening to the\nmoaning of the wind, and thinking what a solemn thing it\nwas to move on through the lonely darkness over an unknown\nabyss, whose depths were secrets as profound as Death: it\nwas a great surprise to Scrooge, while thus engaged, to hear\na hearty laugh. It was a much greater surprise to Scrooge\nto recognise it as his own nephew's and to find himself in a\nbright, dry, gleaming room, with the Spirit standing smiling\nby his side, and looking at that same nephew with approving\naffability!\n\n\"Ha, ha!\" laughed Scrooge's nephew. \"Ha, ha, ha!\"\n\nIf you should happen, by any unlikely chance, to know a\nman more blest in a laugh than Scrooge's nephew, all I can\nsay is, I should like to know him too. Introduce him to me,\nand I'll cultivate his acquaintance.\n\nIt is a fair, even-handed, noble adjustment of things, that\nwhile there is infection in disease and sorrow, there is nothing\nin the world so irresistibly contagious as laughter and\ngood-humour. When Scrooge's nephew laughed in this way: holding\nhis sides, rolling his head, and twisting his face into the\nmost extravagant contortions: Scrooge's niece, by marriage,\nlaughed as heartily as he. And their assembled friends being\nnot a bit behindhand, roared out lustily.\n\n\"Ha, ha! Ha, ha, ha, ha!\"\n\n\"He said that Christmas was a humbug, as I live!\" cried\nScrooge's nephew. \"He believed it too!\"\n\n\"More shame for him, Fred!\" said Scrooge's niece,\nindignantly. Bless those women; they never do anything by\nhalves. They are always in earnest.\n\nShe was very pretty: exceedingly pretty. With a dimpled,\nsurprised-looking, capital face; a ripe little mouth, that\nseemed made to be kissed--as no doubt it was; all kinds of\ngood little dots about her chin, that melted into one another\nwhen she laughed; and the sunniest pair of eyes you ever\nsaw in any little creature's head. Altogether she was what\nyou would have called provoking, you know; but satisfactory, too.\nOh, perfectly satisfactory.\n\n\"He's a comical old fellow,\" said Scrooge's nephew, \"that's\nthe truth: and not so pleasant as he might be. However,\nhis offences carry their own punishment, and I have nothing\nto say against him.\"\n\n\"I'm sure he is very rich, Fred,\" hinted Scrooge's niece.\n\"At least you always tell me so.\"\n\n\"What of that, my dear!\" said Scrooge's nephew. \"His\nwealth is of no use to him. He don't do any good with it.\nHe don't make himself comfortable with it. He hasn't the\nsatisfaction of thinking--ha, ha, ha!--that he is ever going\nto benefit US with it.\"\n\n\"I have no patience with him,\" observed Scrooge's niece.\nScrooge's niece's sisters, and all the other ladies, expressed\nthe same opinion.\n\n\"Oh, I have!\" said Scrooge's nephew. \"I am sorry for\nhim; I couldn't be angry with him if I tried. Who suffers\nby his ill whims! Himself, always. Here, he takes it into\nhis head to dislike us, and he won't come and dine with us.\nWhat's the consequence? He don't lose much of a dinner.\"\n\n\"Indeed, I think he loses a very good dinner,\" interrupted\nScrooge's niece. Everybody else said the same, and they\nmust be allowed to have been competent judges, because\nthey had just had dinner; and, with the dessert upon the\ntable, were clustered round the fire, by lamplight.\n\n\"Well! I'm very glad to hear it,\" said Scrooge's nephew,\n\"because I haven't great faith in these young housekeepers.\nWhat do you say, Topper?\"\n\nTopper had clearly got his eye upon one of Scrooge's niece's\nsisters, for he answered that a bachelor was a wretched outcast,\nwho had no right to express an opinion on the subject.\nWhereat Scrooge's niece's sister--the plump one with the lace\ntucker: not the one with the roses--blushed.\n\n\"Do go on, Fred,\" said Scrooge's niece, clapping her hands.\n\"He never finishes what he begins to say! He is such a\nridiculous fellow!\"\n\nScrooge's nephew revelled in another laugh, and as it was\nimpossible to keep the infection off; though the plump sister\ntried hard to do it with aromatic vinegar; his example was\nunanimously followed.\n\n\"I was only going to say,\" said Scrooge's nephew, \"that\nthe consequence of his taking a dislike to us, and not making\nmerry with us, is, as I think, that he loses some pleasant\nmoments, which could do him no harm. I am sure he loses\npleasanter companions than he can find in his own thoughts,\neither in his mouldy old office, or his dusty chambers. I\nmean to give him the same chance every year, whether he\nlikes it or not, for I pity him. He may rail at Christmas\ntill he dies, but he can't help thinking better of it--I defy\nhim--if he finds me going there, in good temper, year after\nyear, and saying Uncle Scrooge, how are you? If it only\nputs him in the vein to leave his poor clerk fifty pounds,\nthat's something; and I think I shook him yesterday.\"\n\nIt was their turn to laugh now at the notion of his shaking\nScrooge. But being thoroughly good-natured, and not much\ncaring what they laughed at, so that they laughed at any\nrate, he encouraged them in their merriment, and passed the\nbottle joyously.\n\nAfter tea, they had some music. For they were a musical\nfamily, and knew what they were about, when they sung a\nGlee or Catch, I can assure you: especially Topper, who\ncould growl away in the bass like a good one, and never\nswell the large veins in his forehead, or get red in the face\nover it. Scrooge's niece played well upon the harp; and\nplayed among other tunes a simple little air (a mere nothing:\nyou might learn to whistle it in two minutes), which had\nbeen familiar to the child who fetched Scrooge from the\nboarding-school, as he had been reminded by the Ghost of\nChristmas Past. When this strain of music sounded, all the\nthings that Ghost had shown him, came upon his mind; he\nsoftened more and more; and thought that if he could have\nlistened to it often, years ago, he might have cultivated the\nkindnesses of life for his own happiness with his own hands,\nwithout resorting to the sexton's spade that buried Jacob\nMarley.\n\nBut they didn't devote the whole evening to music. After\na while they played at forfeits; for it is good to be children\nsometimes, and never better than at Christmas, when its\nmighty Founder was a child himself. Stop! There was first\na game at blind-man's buff. Of course there was. And I\nno more believe Topper was really blind than I believe he\nhad eyes in his boots. My opinion is, that it was a done\nthing between him and Scrooge's nephew; and that the\nGhost of Christmas Present knew it. The way he went after\nthat plump sister in the lace tucker, was an outrage on the\ncredulity of human nature. Knocking down the fire-irons,\ntumbling over the chairs, bumping against the piano,\nsmothering himself among the curtains, wherever she went,\nthere went he! He always knew where the plump sister was.\nHe wouldn't catch anybody else. If you had fallen up\nagainst him (as some of them did), on purpose, he would\nhave made a feint of endeavouring to seize you, which would\nhave been an affront to your understanding, and would instantly\nhave sidled off in the direction of the plump sister.\nShe often cried out that it wasn't fair; and it really was not.\nBut when at last, he caught her; when, in spite of all her\nsilken rustlings, and her rapid flutterings past him, he got\nher into a corner whence there was no escape; then his\nconduct was the most execrable. For his pretending not to\nknow her; his pretending that it was necessary to touch her\nhead-dress, and further to assure himself of her identity by\npressing a certain ring upon her finger, and a certain chain\nabout her neck; was vile, monstrous! No doubt she told\nhim her opinion of it, when, another blind-man being in\noffice, they were so very confidential together, behind the\ncurtains.\n\nScrooge's niece was not one of the blind-man's buff party,\nbut was made comfortable with a large chair and a footstool,\nin a snug corner, where the Ghost and Scrooge were close\nbehind her. But she joined in the forfeits, and loved her\nlove to admiration with all the letters of the alphabet.\nLikewise at the game of How, When, and Where, she was\nvery great, and to the secret joy of Scrooge's nephew, beat\nher sisters hollow: though they were sharp girls too, as Topper\ncould have told you. There might have been twenty people there,\nyoung and old, but they all played, and so did Scrooge; for\nwholly forgetting in the interest he had in what was going on, that\nhis voice made no sound in their ears, he sometimes came out with\nhis guess quite loud, and very often guessed quite right, too;\nfor the sharpest needle, best Whitechapel, warranted not to cut\nin the eye, was not sharper than Scrooge; blunt as he took it in\nhis head to be.\n\nThe Ghost was greatly pleased to find him in this mood,\nand looked upon him with such favour, that he begged like\na boy to be allowed to stay until the guests departed. But\nthis the Spirit said could not be done.\n\n\"Here is a new game,\" said Scrooge. \"One half hour,\nSpirit, only one!\"\n\nIt was a Game called Yes and No, where Scrooge's nephew\nhad to think of something, and the rest must find out what;\nhe only answering to their questions yes or no, as the case\nwas. The brisk fire of questioning to which he was exposed,\nelicited from him that he was thinking of an animal, a live\nanimal, rather a disagreeable animal, a savage animal, an\nanimal that growled and grunted sometimes, and talked sometimes,\nand lived in London, and walked about the streets,\nand wasn't made a show of, and wasn't led by anybody, and\ndidn't live in a menagerie, and was never killed in a market,\nand was not a horse, or an ass, or a cow, or a bull, or a\ntiger, or a dog, or a pig, or a cat, or a bear. At every fresh\nquestion that was put to him, this nephew burst into a\nfresh roar of laughter; and was so inexpressibly tickled, that\nhe was obliged to get up off the sofa and stamp. At last\nthe plump sister, falling into a similar state, cried out:\n\n\"I have found it out! I know what it is, Fred! I know\nwhat it is!\"\n\n\"What is it?\" cried Fred.\n\n\"It's your Uncle Scro-o-o-o-oge!\"\n\nWhich it certainly was. Admiration was the universal\nsentiment, though some objected that the reply to \"Is it a\nbear?\" ought to have been \"Yes;\" inasmuch as an answer\nin the negative was sufficient to have diverted their thoughts\nfrom Mr. Scrooge, supposing they had ever had any tendency\nthat way.\n\n\"He has given us plenty of merriment, I am sure,\" said\nFred, \"and it would be ungrateful not to drink his health.\nHere is a glass of mulled wine ready to our hand at the\nmoment; and I say, 'Uncle Scrooge!'\"\n\n\"Well! Uncle Scrooge!\" they cried.\n\n\"A Merry Christmas and a Happy New Year to the old\nman, whatever he is!\" said Scrooge's nephew. \"He wouldn't\ntake it from me, but may he have it, nevertheless. Uncle\nScrooge!\"\n\nUncle Scrooge had imperceptibly become so gay and light\nof heart, that he would have pledged the unconscious\ncompany in return, and thanked them in an inaudible speech,\nif the Ghost had given him time. But the whole scene\npassed off in the breath of the last word spoken by his\nnephew; and he and the Spirit were again upon their travels.\n\nMuch they saw, and far they went, and many homes they\nvisited, but always with a happy end. The Spirit stood\nbeside sick beds, and they were cheerful; on foreign lands,\nand they were close at home; by struggling men, and they\nwere patient in their greater hope; by poverty, and it was\nrich. In almshouse, hospital, and jail, in misery's every\nrefuge, where vain man in his little brief authority had not\nmade fast the door, and barred the Spirit out, he left his\nblessing, and taught Scrooge his precepts.\n\nIt was a long night, if it were only a night; but Scrooge\nhad his doubts of this, because the Christmas Holidays appeared\nto be condensed into the space of time they passed\ntogether. It was strange, too, that while Scrooge remained\nunaltered in his outward form, the Ghost grew older, clearly\nolder. Scrooge had observed this change, but never spoke of\nit, until they left a children's Twelfth Night party, when,\nlooking at the Spirit as they stood together in an open place,\nhe noticed that its hair was grey.\n\n\"Are spirits' lives so short?\" asked Scrooge.\n\n\"My life upon this globe, is very brief,\" replied the Ghost.\n\"It ends to-night.\"\n\n\"To-night!\" cried Scrooge.\n\n\"To-night at midnight. Hark! The time is drawing\nnear.\"\n\nThe chimes were ringing the three quarters past eleven at\nthat moment.\n\n\"Forgive me if I am not justified in what I ask,\" said\nScrooge, looking intently at the Spirit's robe, \"but I see\nsomething strange, and not belonging to yourself, protruding\nfrom your skirts. Is it a foot or a claw?\"\n\n\"It might be a claw, for the flesh there is upon it,\" was\nthe Spirit's sorrowful reply. \"Look here.\"\n\nFrom the foldings of its robe, it brought two children;\nwretched, abject, frightful, hideous, miserable. They knelt\ndown at its feet, and clung upon the outside of its garment.\n\n\"Oh, Man! look here. Look, look, down here!\" exclaimed\nthe Ghost.\n\nThey were a boy and girl. Yellow, meagre, ragged, scowling,\nwolfish; but prostrate, too, in their humility. Where\ngraceful youth should have filled their features out, and\ntouched them with its freshest tints, a stale and shrivelled\nhand, like that of age, had pinched, and twisted them, and\npulled them into shreds. Where angels might have sat\nenthroned, devils lurked, and glared out menacing. No\nchange, no degradation, no perversion of humanity, in any\ngrade, through all the mysteries of wonderful creation, has\nmonsters half so horrible and dread.\n\nScrooge started back, appalled. Having them shown to\nhim in this way, he tried to say they were fine children, but\nthe words choked themselves, rather than be parties to a lie\nof such enormous magnitude.\n\n\"Spirit! are they yours?\" Scrooge could say no more.\n\n\"They are Man's,\" said the Spirit, looking down upon\nthem. \"And they cling to me, appealing from their fathers.\nThis boy is Ignorance. This girl is Want. Beware them both,\nand all of their degree, but most of all beware this boy, for\non his brow I see that written which is Doom, unless the\nwriting be erased. Deny it!\" cried the Spirit, stretching out\nits hand towards the city. \"Slander those who tell it ye!\nAdmit it for your factious purposes, and make it worse.\nAnd bide the end!\"\n\n\"Have they no refuge or resource?\" cried Scrooge.\n\n\"Are there no prisons?\" said the Spirit, turning on him\nfor the last time with his own words. \"Are there no workhouses?\"\n\nThe bell struck twelve.\n\nScrooge looked about him for the Ghost, and saw it not.\nAs the last stroke ceased to vibrate, he remembered the\nprediction of old Jacob Marley, and lifting up his eyes,\nbeheld a solemn Phantom, draped and hooded, coming, like\na mist along the ground, towards him.\n\n\nSTAVE IV:  THE LAST OF THE SPIRITS\n\nTHE Phantom slowly, gravely, silently, approached. When\nit came near him, Scrooge bent down upon his knee; for in\nthe very air through which this Spirit moved it seemed to\nscatter gloom and mystery.\n\nIt was shrouded in a deep black garment, which concealed\nits head, its face, its form, and left nothing of it visible\nsave one outstretched hand. But for this it would have been\ndifficult to detach its figure from the night, and separate it\nfrom the darkness by which it was surrounded.\n\nHe felt that it was tall and stately when it came beside\nhim, and that its mysterious presence filled him with a\nsolemn dread. He knew no more, for the Spirit neither\nspoke nor moved.\n\n\"I am in the presence of the Ghost of Christmas Yet To\nCome?\" said Scrooge.\n\nThe Spirit answered not, but pointed onward with its\nhand.\n\n\"You are about to show me shadows of the things that\nhave not happened, but will happen in the time before us,\"\nScrooge pursued. \"Is that so, Spirit?\"\n\nThe upper portion of the garment was contracted for an\ninstant in its folds, as if the Spirit had inclined its head.\nThat was the only answer he received.\n\nAlthough well used to ghostly company by this time,\nScrooge feared the silent shape so much that his legs trembled\nbeneath him, and he found that he could hardly stand when\nhe prepared to follow it. The Spirit paused a moment, as\nobserving his condition, and giving him time to recover.\n\nBut Scrooge was all the worse for this. It thrilled him\nwith a vague uncertain horror, to know that behind the\ndusky shroud, there were ghostly eyes intently fixed upon\nhim, while he, though he stretched his own to the utmost,\ncould see nothing but a spectral hand and one great heap\nof black.\n\n\"Ghost of the Future!\" he exclaimed, \"I fear you more\nthan any spectre I have seen. But as I know your purpose\nis to do me good, and as I hope to live to be another\nman from what I was, I am prepared to bear you company,\nand do it with a thankful heart. Will you not speak\nto me?\"\n\nIt gave him no reply. The hand was pointed straight\nbefore them.\n\n\"Lead on!\" said Scrooge. \"Lead on! The night is\nwaning fast, and it is precious time to me, I know. Lead\non, Spirit!\"\n\nThe Phantom moved away as it had come towards him.\nScrooge followed in the shadow of its dress, which bore him\nup, he thought, and carried him along.\n\nThey scarcely seemed to enter the city; for the city rather\nseemed to spring up about them, and encompass them of its\nown act. But there they were, in the heart of it; on\n'Change, amongst the merchants; who hurried up and down,\nand chinked the money in their pockets, and conversed in\ngroups, and looked at their watches, and trifled thoughtfully\nwith their great gold seals; and so forth, as Scrooge had\nseen them often.\n\nThe Spirit stopped beside one little knot of business men.\nObserving that the hand was pointed to them, Scrooge\nadvanced to listen to their talk.\n\n\"No,\" said a great fat man with a monstrous chin, \"I\ndon't know much about it, either way. I only know he's\ndead.\"\n\n\"When did he die?\" inquired another.\n\n\"Last night, I believe.\"\n\n\"Why, what was the matter with him?\" asked a third,\ntaking a vast quantity of snuff out of a very large snuff-box.\n\"I thought he'd never die.\"\n\n\"God knows,\" said the first, with a yawn.\n\n\"What has he done with his money?\" asked a red-faced\ngentleman with a pendulous excrescence on the end of his\nnose, that shook like the gills of a turkey-cock.\n\n\"I haven't heard,\" said the man with the large chin,\nyawning again. \"Left it to his company, perhaps. He hasn't\nleft it to me. That's all I know.\"\n\nThis pleasantry was received with a general laugh.\n\n\"It's likely to be a very cheap funeral,\" said the same\nspeaker; \"for upon my life I don't know of anybody to go\nto it. Suppose we make up a party and volunteer?\"\n\n\"I don't mind going if a lunch is provided,\" observed the\ngentleman with the excrescence on his nose. \"But I must\nbe fed, if I make one.\"\n\nAnother laugh.\n\n\"Well, I am the most disinterested among you, after all,\"\nsaid the first speaker, \"for I never wear black gloves, and I\nnever eat lunch. But I'll offer to go, if anybody else will.\nWhen I come to think of it, I'm not at all sure that I wasn't\nhis most particular friend; for we used to stop and speak\nwhenever we met. Bye, bye!\"\n\nSpeakers and listeners strolled away, and mixed with\nother groups. Scrooge knew the men, and looked towards the\nSpirit for an explanation.\n\nThe Phantom glided on into a street. Its finger pointed\nto two persons meeting. Scrooge listened again, thinking\nthat the explanation might lie here.\n\nHe knew these men, also, perfectly. They were men of business:\nvery wealthy, and of great importance. He had made a point\nalways of standing well in their esteem: in a business point\nof view, that is; strictly in a business point of view.\n\n\"How are you?\" said one.\n\n\"How are you?\" returned the other.\n\n\"Well!\" said the first. \"Old Scratch has got his own at\nlast, hey?\"\n\n\"So I am told,\" returned the second. \"Cold, isn't it?\"\n\n\"Seasonable for Christmas time. You're not a skater, I\nsuppose?\"\n\n\"No. No. Something else to think of. Good morning!\"\n\nNot another word. That was their meeting, their\nconversation, and their parting.\n\nScrooge was at first inclined to be surprised that the\nSpirit should attach importance to conversations apparently so\ntrivial; but feeling assured that they must have some hidden\npurpose, he set himself to consider what it was likely to be.\nThey could scarcely be supposed to have any bearing on the\ndeath of Jacob, his old partner, for that was Past, and this\nGhost's province was the Future. Nor could he think of any\none immediately connected with himself, to whom he could\napply them. But nothing doubting that to whomsoever they\napplied they had some latent moral for his own improvement,\nhe resolved to treasure up every word he heard,\nand everything he saw; and especially to observe the\nshadow of himself when it appeared. For he had an expectation\nthat the conduct of his future self would give him\nthe clue he missed, and would render the solution of these\nriddles easy.\n\nHe looked about in that very place for his own image; but\nanother man stood in his accustomed corner, and though the\nclock pointed to his usual time of day for being there, he\nsaw no likeness of himself among the multitudes that poured\nin through the Porch. It gave him little surprise, however;\nfor he had been revolving in his mind a change of life, and\nthought and hoped he saw his new-born resolutions carried\nout in this.\n\nQuiet and dark, beside him stood the Phantom, with its\noutstretched hand. When he roused himself from his\nthoughtful quest, he fancied from the turn of the hand, and\nits situation in reference to himself, that the Unseen Eyes\nwere looking at him keenly. It made him shudder, and feel\nvery cold.\n\nThey left the busy scene, and went into an obscure part\nof the town, where Scrooge had never penetrated before,\nalthough he recognised its situation, and its bad repute. The\nways were foul and narrow; the shops and houses wretched;\nthe people half-naked, drunken, slipshod, ugly. Alleys and\narchways, like so many cesspools, disgorged their offences of\nsmell, and dirt, and life, upon the straggling streets; and the\nwhole quarter reeked with crime, with filth, and misery.\n\nFar in this den of infamous resort, there was a low-browed,\nbeetling shop, below a pent-house roof, where iron, old rags,\nbottles, bones, and greasy offal, were bought. Upon the floor\nwithin, were piled up heaps of rusty keys, nails, chains, hinges,\nfiles, scales, weights, and refuse iron of all kinds. Secrets\nthat few would like to scrutinise were bred and hidden in\nmountains of unseemly rags, masses of corrupted fat, and\nsepulchres of bones. Sitting in among the wares he dealt in, by a\ncharcoal stove, made of old bricks, was a grey-haired rascal,\nnearly seventy years of age; who had screened himself from the\ncold air without, by a frousy curtaining of miscellaneous\ntatters, hung upon a line; and smoked his pipe in all the luxury\nof calm retirement.\n\nScrooge and the Phantom came into the presence of this\nman, just as a woman with a heavy bundle slunk into the\nshop. But she had scarcely entered, when another woman,\nsimilarly laden, came in too; and she was closely followed by\na man in faded black, who was no less startled by the sight\nof them, than they had been upon the recognition of each\nother. After a short period of blank astonishment, in which\nthe old man with the pipe had joined them, they all three\nburst into a laugh.\n\n\"Let the charwoman alone to be the first!\" cried she who\nhad entered first. \"Let the laundress alone to be the second;\nand let the undertaker's man alone to be the third. Look\nhere, old Joe, here's a chance! If we haven't all three met\nhere without meaning it!\"\n\n\"You couldn't have met in a better place,\" said old Joe,\nremoving his pipe from his mouth. \"Come into the parlour.\nYou were made free of it long ago, you know; and the other\ntwo an't strangers. Stop till I shut the door of the shop.\nAh! How it skreeks! There an't such a rusty bit of metal\nin the place as its own hinges, I believe; and I'm sure there's\nno such old bones here, as mine. Ha, ha! We're all suitable\nto our calling, we're well matched. Come into the\nparlour. Come into the parlour.\"\n\nThe parlour was the space behind the screen of rags. The\nold man raked the fire together with an old stair-rod, and\nhaving trimmed his smoky lamp (for it was night), with the\nstem of his pipe, put it in his mouth again.\n\nWhile he did this, the woman who had already spoken\nthrew her bundle on the floor, and sat down in a flaunting\nmanner on a stool; crossing her elbows on her knees, and\nlooking with a bold defiance at the other two.\n\n\"What odds then! What odds, Mrs. Dilber?\" said the\nwoman. \"Every person has a right to take care of themselves.\nHe always did.\"\n\n\"That's true, indeed!\" said the laundress. \"No man\nmore so.\"\n\n\"Why then, don't stand staring as if you was afraid,\nwoman; who's the wiser? We're not going to pick holes in\neach other's coats, I suppose?\"\n\n\"No, indeed!\" said Mrs. Dilber and the man together.\n\"We should hope not.\"\n\n\"Very well, then!\" cried the woman. \"That's enough.\nWho's the worse for the loss of a few things like these?\nNot a dead man, I suppose.\"\n\n\"No, indeed,\" said Mrs. Dilber, laughing.\n\n\"If he wanted to keep 'em after he was dead, a wicked old\nscrew,\" pursued the woman, \"why wasn't he natural in his\nlifetime? If he had been, he'd have had somebody to look\nafter him when he was struck with Death, instead of lying\ngasping out his last there, alone by himself.\"\n\n\"It's the truest word that ever was spoke,\" said Mrs.\nDilber. \"It's a judgment on him.\"\n\n\"I wish it was a little heavier judgment,\" replied the\nwoman; \"and it should have been, you may depend upon it,\nif I could have laid my hands on anything else. Open that\nbundle, old Joe, and let me know the value of it. Speak out\nplain. I'm not afraid to be the first, nor afraid for them to\nsee it. We know pretty well that we were helping ourselves,\nbefore we met here, I believe. It's no sin. Open the bundle,\nJoe.\"\n\nBut the gallantry of her friends would not allow of this;\nand the man in faded black, mounting the breach first,\nproduced his plunder. It was not extensive. A seal or two,\na pencil-case, a pair of sleeve-buttons, and a brooch of no\ngreat value, were all. They were severally examined and\nappraised by old Joe, who chalked the sums he was disposed\nto give for each, upon the wall, and added them up into a\ntotal when he found there was nothing more to come.\n\n\"That's your account,\" said Joe, \"and I wouldn't give\nanother sixpence, if I was to be boiled for not doing it.\nWho's next?\"\n\nMrs. Dilber was next. Sheets and towels, a little wearing\napparel, two old-fashioned silver teaspoons, a pair of\nsugar-tongs, and a few boots. Her account was stated on the wall\nin the same manner.\n\n\"I always give too much to ladies. It's a weakness of mine,\nand that's the way I ruin myself,\" said old Joe. \"That's\nyour account. If you asked me for another penny, and made\nit an open question, I'd repent of being so liberal and knock\noff half-a-crown.\"\n\n\"And now undo my bundle, Joe,\" said the first woman.\n\nJoe went down on his knees for the greater convenience\nof opening it, and having unfastened a great many knots,\ndragged out a large and heavy roll of some dark stuff.\n\n\"What do you call this?\" said Joe. \"Bed-curtains!\"\n\n\"Ah!\" returned the woman, laughing and leaning forward\non her crossed arms. \"Bed-curtains!\"\n\n\"You don't mean to say you took 'em down, rings and\nall, with him lying there?\" said Joe.\n\n\"Yes I do,\" replied the woman. \"Why not?\"\n\n\"You were born to make your fortune,\" said Joe, \"and\nyou'll certainly do it.\"\n\n\"I certainly shan't hold my hand, when I can get anything\nin it by reaching it out, for the sake of such a man as He\nwas, I promise you, Joe,\" returned the woman coolly. \"Don't\ndrop that oil upon the blankets, now.\"\n\n\"His blankets?\" asked Joe.\n\n\"Whose else's do you think?\" replied the woman. \"He\nisn't likely to take cold without 'em, I dare say.\"\n\n\"I hope he didn't die of anything catching? Eh?\" said\nold Joe, stopping in his work, and looking up.\n\n\"Don't you be afraid of that,\" returned the woman. \"I\nan't so fond of his company that I'd loiter about him for\nsuch things, if he did. Ah! you may look through that\nshirt till your eyes ache; but you won't find a hole in it, nor\na threadbare place. It's the best he had, and a fine one too.\nThey'd have wasted it, if it hadn't been for me.\"\n\n\"What do you call wasting of it?\" asked old Joe.\n\n\"Putting it on him to be buried in, to be sure,\" replied\nthe woman with a laugh. \"Somebody was fool enough to\ndo it, but I took it off again. If calico an't good enough for\nsuch a purpose, it isn't good enough for anything. It's quite\nas becoming to the body. He can't look uglier than he did\nin that one.\"\n\nScrooge listened to this dialogue in horror. As they sat\ngrouped about their spoil, in the scanty light afforded by\nthe old man's lamp, he viewed them with a detestation and\ndisgust, which could hardly have been greater, though they\nhad been obscene demons, marketing the corpse itself.\n\n\"Ha, ha!\" laughed the same woman, when old Joe,\nproducing a flannel bag with money in it, told out their\nseveral gains upon the ground. \"This is the end of it, you\nsee! He frightened every one away from him when he was\nalive, to profit us when he was dead! Ha, ha, ha!\"\n\n\"Spirit!\" said Scrooge, shuddering from head to foot. \"I\nsee, I see. The case of this unhappy man might be my own.\nMy life tends that way, now. Merciful Heaven, what is\nthis!\"\n\nHe recoiled in terror, for the scene had changed, and now\nhe almost touched a bed: a bare, uncurtained bed: on which,\nbeneath a ragged sheet, there lay a something covered up,\nwhich, though it was dumb, announced itself in awful\nlanguage.\n\nThe room was very dark, too dark to be observed with\nany accuracy, though Scrooge glanced round it in obedience\nto a secret impulse, anxious to know what kind of room it\nwas. A pale light, rising in the outer air, fell straight upon\nthe bed; and on it, plundered and bereft, unwatched, unwept,\nuncared for, was the body of this man.\n\nScrooge glanced towards the Phantom. Its steady hand\nwas pointed to the head. The cover was so carelessly adjusted\nthat the slightest raising of it, the motion of a finger upon\nScrooge's part, would have disclosed the face. He thought\nof it, felt how easy it would be to do, and longed to do it;\nbut had no more power to withdraw the veil than to dismiss\nthe spectre at his side.\n\nOh cold, cold, rigid, dreadful Death, set up thine altar\nhere, and dress it with such terrors as thou hast at thy\ncommand: for this is thy dominion! But of the loved,\nrevered, and honoured head, thou canst not turn one hair\nto thy dread purposes, or make one feature odious. It is\nnot that the hand is heavy and will fall down when released;\nit is not that the heart and pulse are still; but that the\nhand WAS open, generous, and true; the heart brave, warm,\nand tender; and the pulse a man's. Strike, Shadow, strike!\nAnd see his good deeds springing from the wound, to sow\nthe world with life immortal!\n\nNo voice pronounced these words in Scrooge's ears, and\nyet he heard them when he looked upon the bed. He\nthought, if this man could be raised up now, what would be\nhis foremost thoughts? Avarice, hard-dealing, griping cares?\nThey have brought him to a rich end, truly!\n\nHe lay, in the dark empty house, with not a man, a\nwoman, or a child, to say that he was kind to me in this\nor that, and for the memory of one kind word I will be\nkind to him. A cat was tearing at the door, and there was\na sound of gnawing rats beneath the hearth-stone. What\nthey wanted in the room of death, and why they were so\nrestless and disturbed, Scrooge did not dare to think.\n\n\"Spirit!\" he said, \"this is a fearful place. In leaving it,\nI shall not leave its lesson, trust me. Let us go!\"\n\nStill the Ghost pointed with an unmoved finger to the\nhead.\n\n\"I understand you,\" Scrooge returned, \"and I would do\nit, if I could. But I have not the power, Spirit. I have\nnot the power.\"\n\nAgain it seemed to look upon him.\n\n\"If there is any person in the town, who feels emotion\ncaused by this man's death,\" said Scrooge quite agonised,\n\"show that person to me, Spirit, I beseech you!\"\n\nThe Phantom spread its dark robe before him for a\nmoment, like a wing; and withdrawing it, revealed a room\nby daylight, where a mother and her children were.\n\nShe was expecting some one, and with anxious eagerness;\nfor she walked up and down the room; started at every\nsound; looked out from the window; glanced at the clock;\ntried, but in vain, to work with her needle; and could hardly\nbear the voices of the children in their play.\n\nAt length the long-expected knock was heard. She hurried\nto the door, and met her husband; a man whose face was\ncareworn and depressed, though he was young. There was\na remarkable expression in it now; a kind of serious delight\nof which he felt ashamed, and which he struggled to repress.\n\nHe sat down to the dinner that had been hoarding for\nhim by the fire; and when she asked him faintly what news\n(which was not until after a long silence), he appeared\nembarrassed how to answer.\n\n\"Is it good?\" she said, \"or bad?\"--to help him.\n\n\"Bad,\" he answered.\n\n\"We are quite ruined?\"\n\n\"No. There is hope yet, Caroline.\"\n\n\"If he relents,\" she said, amazed, \"there is! Nothing is\npast hope, if such a miracle has happened.\"\n\n\"He is past relenting,\" said her husband. \"He is dead.\"\n\nShe was a mild and patient creature if her face spoke\ntruth; but she was thankful in her soul to hear it, and she\nsaid so, with clasped hands. She prayed forgiveness the next\nmoment, and was sorry; but the first was the emotion of\nher heart.\n\n\"What the half-drunken woman whom I told you of last\nnight, said to me, when I tried to see him and obtain a\nweek's delay; and what I thought was a mere excuse to avoid\nme; turns out to have been quite true. He was not only\nvery ill, but dying, then.\"\n\n\"To whom will our debt be transferred?\"\n\n\"I don't know. But before that time we shall be ready\nwith the money; and even though we were not, it would be\na bad fortune indeed to find so merciless a creditor in his\nsuccessor. We may sleep to-night with light hearts, Caroline!\"\n\nYes. Soften it as they would, their hearts were lighter.\nThe children's faces, hushed and clustered round to hear what\nthey so little understood, were brighter; and it was a happier\nhouse for this man's death! The only emotion that the\nGhost could show him, caused by the event, was one of\npleasure.\n\n\"Let me see some tenderness connected with a death,\" said\nScrooge; \"or that dark chamber, Spirit, which we left just\nnow, will be for ever present to me.\"\n\nThe Ghost conducted him through several streets familiar\nto his feet; and as they went along, Scrooge looked here and\nthere to find himself, but nowhere was he to be seen. They\nentered poor Bob Cratchit's house; the dwelling he had\nvisited before; and found the mother and the children seated\nround the fire.\n\nQuiet. Very quiet. The noisy little Cratchits were as\nstill as statues in one corner, and sat looking up at Peter,\nwho had a book before him. The mother and her daughters\nwere engaged in sewing. But surely they were very quiet!\n\n\"'And He took a child, and set him in the midst of\nthem.'\"\n\nWhere had Scrooge heard those words? He had not\ndreamed them. The boy must have read them out, as he\nand the Spirit crossed the threshold. Why did he not\ngo on?\n\nThe mother laid her work upon the table, and put her\nhand up to her face.\n\n\"The colour hurts my eyes,\" she said.\n\nThe colour? Ah, poor Tiny Tim!\n\n\"They're better now again,\" said Cratchit's wife. \"It\nmakes them weak by candle-light; and I wouldn't show weak\neyes to your father when he comes home, for the world. It\nmust be near his time.\"\n\n\"Past it rather,\" Peter answered, shutting up his book.\n\"But I think he has walked a little slower than he used,\nthese few last evenings, mother.\"\n\nThey were very quiet again. At last she said, and in a\nsteady, cheerful voice, that only faltered once:\n\n\"I have known him walk with--I have known him walk\nwith Tiny Tim upon his shoulder, very fast indeed.\"\n\n\"And so have I,\" cried Peter. \"Often.\"\n\n\"And so have I,\" exclaimed another. So had all.\n\n\"But he was very light to carry,\" she resumed, intent upon\nher work, \"and his father loved him so, that it was no\ntrouble: no trouble. And there is your father at the door!\"\n\nShe hurried out to meet him; and little Bob in his comforter\n--he had need of it, poor fellow--came in. His tea\nwas ready for him on the hob, and they all tried who should\nhelp him to it most. Then the two young Cratchits got\nupon his knees and laid, each child a little cheek, against\nhis face, as if they said, \"Don't mind it, father. Don't be\ngrieved!\"\n\nBob was very cheerful with them, and spoke pleasantly to\nall the family. He looked at the work upon the table, and\npraised the industry and speed of Mrs. Cratchit and the girls.\nThey would be done long before Sunday, he said.\n\n\"Sunday! You went to-day, then, Robert?\" said his\nwife.\n\n\"Yes, my dear,\" returned Bob. \"I wish you could have\ngone. It would have done you good to see how green a\nplace it is. But you'll see it often. I promised him that I\nwould walk there on a Sunday. My little, little child!\"\ncried Bob. \"My little child!\"\n\nHe broke down all at once. He couldn't help it. If he\ncould have helped it, he and his child would have been farther\napart perhaps than they were.\n\nHe left the room, and went up-stairs into the room above,\nwhich was lighted cheerfully, and hung with Christmas.\nThere was a chair set close beside the child, and there were\nsigns of some one having been there, lately. Poor Bob sat\ndown in it, and when he had thought a little and composed\nhimself, he kissed the little face. He was reconciled to what\nhad happened, and went down again quite happy.\n\nThey drew about the fire, and talked; the girls and mother\nworking still. Bob told them of the extraordinary kindness\nof Mr. Scrooge's nephew, whom he had scarcely seen but\nonce, and who, meeting him in the street that day, and seeing\nthat he looked a little--\"just a little down you know,\" said\nBob, inquired what had happened to distress him. \"On\nwhich,\" said Bob, \"for he is the pleasantest-spoken gentleman\nyou ever heard, I told him. 'I am heartily sorry for it, Mr.\nCratchit,' he said, 'and heartily sorry for your good wife.'\nBy the bye, how he ever knew that, I don't know.\"\n\n\"Knew what, my dear?\"\n\n\"Why, that you were a good wife,\" replied Bob.\n\n\"Everybody knows that!\" said Peter.\n\n\"Very well observed, my boy!\" cried Bob. \"I hope they\ndo. 'Heartily sorry,' he said, 'for your good wife. If I\ncan be of service to you in any way,' he said, giving me\nhis card, 'that's where I live. Pray come to me.' Now, it\nwasn't,\" cried Bob, \"for the sake of anything he might be\nable to do for us, so much as for his kind way, that this was\nquite delightful. It really seemed as if he had known our\nTiny Tim, and felt with us.\"\n\n\"I'm sure he's a good soul!\" said Mrs. Cratchit.\n\n\"You would be surer of it, my dear,\" returned Bob, \"if\nyou saw and spoke to him. I shouldn't be at all surprised--\nmark what I say!--if he got Peter a better situation.\"\n\n\"Only hear that, Peter,\" said Mrs. Cratchit.\n\n\"And then,\" cried one of the girls, \"Peter will be keeping\ncompany with some one, and setting up for himself.\"\n\n\"Get along with you!\" retorted Peter, grinning.\n\n\"It's just as likely as not,\" said Bob, \"one of these days;\nthough there's plenty of time for that, my dear. But however\nand whenever we part from one another, I am sure we\nshall none of us forget poor Tiny Tim--shall we--or this\nfirst parting that there was among us?\"\n\n\"Never, father!\" cried they all.\n\n\"And I know,\" said Bob, \"I know, my dears, that when\nwe recollect how patient and how mild he was; although he\nwas a little, little child; we shall not quarrel easily among\nourselves, and forget poor Tiny Tim in doing it.\"\n\n\"No, never, father!\" they all cried again.\n\n\"I am very happy,\" said little Bob, \"I am very happy!\"\n\nMrs. Cratchit kissed him, his daughters kissed him, the\ntwo young Cratchits kissed him, and Peter and himself shook\nhands. Spirit of Tiny Tim, thy childish essence was from\nGod!\n\n\"Spectre,\" said Scrooge, \"something informs me that our\nparting moment is at hand. I know it, but I know not\nhow. Tell me what man that was whom we saw lying dead?\"\n\nThe Ghost of Christmas Yet To Come conveyed him, as\nbefore--though at a different time, he thought: indeed, there\nseemed no order in these latter visions, save that they were\nin the Future--into the resorts of business men, but showed\nhim not himself. Indeed, the Spirit did not stay for anything,\nbut went straight on, as to the end just now desired,\nuntil besought by Scrooge to tarry for a moment.\n\n\"This court,\" said Scrooge, \"through which we hurry now,\nis where my place of occupation is, and has been for a length\nof time. I see the house. Let me behold what I shall be,\nin days to come!\"\n\nThe Spirit stopped; the hand was pointed elsewhere.\n\n\"The house is yonder,\" Scrooge exclaimed. \"Why do you\npoint away?\"\n\nThe inexorable finger underwent no change.\n\nScrooge hastened to the window of his office, and looked\nin. It was an office still, but not his. The furniture was\nnot the same, and the figure in the chair was not himself.\nThe Phantom pointed as before.\n\nHe joined it once again, and wondering why and whither\nhe had gone, accompanied it until they reached an iron gate.\nHe paused to look round before entering.\n\nA churchyard. Here, then; the wretched man whose name\nhe had now to learn, lay underneath the ground. It was a\nworthy place. Walled in by houses; overrun by grass and\nweeds, the growth of vegetation's death, not life; choked up\nwith too much burying; fat with repleted appetite. A\nworthy place!\n\nThe Spirit stood among the graves, and pointed down to\nOne. He advanced towards it trembling. The Phantom was\nexactly as it had been, but he dreaded that he saw new\nmeaning in its solemn shape.\n\n\"Before I draw nearer to that stone to which you point,\"\nsaid Scrooge, \"answer me one question. Are these the\nshadows of the things that Will be, or are they shadows of\nthings that May be, only?\"\n\nStill the Ghost pointed downward to the grave by which\nit stood.\n\n\"Men's courses will foreshadow certain ends, to which, if\npersevered in, they must lead,\" said Scrooge. \"But if the\ncourses be departed from, the ends will change. Say it is\nthus with what you show me!\"\n\nThe Spirit was immovable as ever.\n\nScrooge crept towards it, trembling as he went; and\nfollowing the finger, read upon the stone of the neglected\ngrave his own name, EBENEZER SCROOGE.\n\n\"Am I that man who lay upon the bed?\" he cried, upon\nhis knees.\n\nThe finger pointed from the grave to him, and back again.\n\n\"No, Spirit! Oh no, no!\"\n\nThe finger still was there.\n\n\"Spirit!\" he cried, tight clutching at its robe, \"hear me!\nI am not the man I was. I will not be the man I must\nhave been but for this intercourse. Why show me this, if I\nam past all hope!\"\n\nFor the first time the hand appeared to shake.\n\n\"Good Spirit,\" he pursued, as down upon the ground he\nfell before it: \"Your nature intercedes for me, and pities\nme. Assure me that I yet may change these shadows you\nhave shown me, by an altered life!\"\n\nThe kind hand trembled.\n\n\"I will honour Christmas in my heart, and try to keep it\nall the year. I will live in the Past, the Present, and the\nFuture. The Spirits of all Three shall strive within me. I\nwill not shut out the lessons that they teach. Oh, tell me I\nmay sponge away the writing on this stone!\"\n\nIn his agony, he caught the spectral hand. It sought to\nfree itself, but he was strong in his entreaty, and detained it.\nThe Spirit, stronger yet, repulsed him.\n\nHolding up his hands in a last prayer to have his fate\nreversed, he saw an alteration in the Phantom's hood and dress.\nIt shrunk, collapsed, and dwindled down into a bedpost.\n\n\nSTAVE V:  THE END OF IT\n\nYES! and the bedpost was his own. The bed was his own,\nthe room was his own. Best and happiest of all, the Time\nbefore him was his own, to make amends in!\n\n\"I will live in the Past, the Present, and the Future!\"\nScrooge repeated, as he scrambled out of bed. \"The Spirits\nof all Three shall strive within me. Oh Jacob Marley!\nHeaven, and the Christmas Time be praised for this! I say\nit on my knees, old Jacob; on my knees!\"\n\nHe was so fluttered and so glowing with his good intentions,\nthat his broken voice would scarcely answer to his\ncall. He had been sobbing violently in his conflict with the\nSpirit, and his face was wet with tears.\n\n\"They are not torn down,\" cried Scrooge, folding one of\nhis bed-curtains in his arms, \"they are not torn down, rings\nand all. They are here--I am here--the shadows of the\nthings that would have been, may be dispelled. They will\nbe. I know they will!\"\n\nHis hands were busy with his garments all this time;\nturning them inside out, putting them on upside down,\ntearing them, mislaying them, making them parties to every\nkind of extravagance.\n\n\"I don't know what to do!\" cried Scrooge, laughing and\ncrying in the same breath; and making a perfect Laocon of\nhimself with his stockings. \"I am as light as a feather, I\nam as happy as an angel, I am as merry as a schoolboy. I\nam as giddy as a drunken man. A merry Christmas to\neverybody! A happy New Year to all the world. Hallo\nhere! Whoop! Hallo!\"\n\nHe had frisked into the sitting-room, and was now standing\nthere: perfectly winded.\n\n\"There's the saucepan that the gruel was in!\" cried\nScrooge, starting off again, and going round the fireplace.\n\"There's the door, by which the Ghost of Jacob Marley\nentered! There's the corner where the Ghost of Christmas\nPresent, sat! There's the window where I saw the wandering\nSpirits! It's all right, it's all true, it all happened.\nHa ha ha!\"\n\nReally, for a man who had been out of practice for so\nmany years, it was a splendid laugh, a most illustrious laugh.\nThe father of a long, long line of brilliant laughs!\n\n\"I don't know what day of the month it is!\" said\nScrooge. \"I don't know how long I've been among the\nSpirits. I don't know anything. I'm quite a baby. Never\nmind. I don't care. I'd rather be a baby. Hallo! Whoop!\nHallo here!\"\n\nHe was checked in his transports by the churches ringing\nout the lustiest peals he had ever heard. Clash, clang,\nhammer; ding, dong, bell. Bell, dong, ding; hammer, clang,\nclash! Oh, glorious, glorious!\n\nRunning to the window, he opened it, and put out his\nhead. No fog, no mist; clear, bright, jovial, stirring, cold;\ncold, piping for the blood to dance to; Golden sunlight;\nHeavenly sky; sweet fresh air; merry bells. Oh, glorious!\nGlorious!\n\n\"What's to-day!\" cried Scrooge, calling downward to a\nboy in Sunday clothes, who perhaps had loitered in to look\nabout him.\n\n\"EH?\" returned the boy, with all his might of wonder.\n\n\"What's to-day, my fine fellow?\" said Scrooge.\n\n\"To-day!\" replied the boy. \"Why, CHRISTMAS DAY.\"\n\n\"It's Christmas Day!\" said Scrooge to himself. \"I\nhaven't missed it. The Spirits have done it all in one night.\nThey can do anything they like. Of course they can. Of\ncourse they can. Hallo, my fine fellow!\"\n\n\"Hallo!\" returned the boy.\n\n\"Do you know the Poulterer's, in the next street but one,\nat the corner?\" Scrooge inquired.\n\n\"I should hope I did,\" replied the lad.\n\n\"An intelligent boy!\" said Scrooge. \"A remarkable boy!\nDo you know whether they've sold the prize Turkey that\nwas hanging up there?--Not the little prize Turkey: the\nbig one?\"\n\n\"What, the one as big as me?\" returned the boy.\n\n\"What a delightful boy!\" said Scrooge. \"It's a pleasure\nto talk to him. Yes, my buck!\"\n\n\"It's hanging there now,\" replied the boy.\n\n\"Is it?\" said Scrooge. \"Go and buy it.\"\n\n\"Walk-ER!\" exclaimed the boy.\n\n\"No, no,\" said Scrooge, \"I am in earnest. Go and buy\nit, and tell 'em to bring it here, that I may give them the\ndirection where to take it. Come back with the man, and\nI'll give you a shilling. Come back with him in less than\nfive minutes and I'll give you half-a-crown!\"\n\nThe boy was off like a shot. He must have had a steady\nhand at a trigger who could have got a shot off half so fast.\n\n\"I'll send it to Bob Cratchit's!\" whispered Scrooge,\nrubbing his hands, and splitting with a laugh. \"He sha'n't\nknow who sends it. It's twice the size of Tiny Tim. Joe\nMiller never made such a joke as sending it to Bob's\nwill be!\"\n\nThe hand in which he wrote the address was not a steady\none, but write it he did, somehow, and went down-stairs to\nopen the street door, ready for the coming of the poulterer's\nman. As he stood there, waiting his arrival, the knocker\ncaught his eye.\n\n\"I shall love it, as long as I live!\" cried Scrooge, patting\nit with his hand. \"I scarcely ever looked at it before.\nWhat an honest expression it has in its face! It's a\nwonderful knocker!--Here's the Turkey! Hallo! Whoop!\nHow are you! Merry Christmas!\"\n\nIt was a Turkey! He never could have stood upon his\nlegs, that bird. He would have snapped 'em short off in a\nminute, like sticks of sealing-wax.\n\n\"Why, it's impossible to carry that to Camden Town,\"\nsaid Scrooge. \"You must have a cab.\"\n\nThe chuckle with which he said this, and the chuckle with\nwhich he paid for the Turkey, and the chuckle with which\nhe paid for the cab, and the chuckle with which he recompensed\nthe boy, were only to be exceeded by the chuckle\nwith which he sat down breathless in his chair again, and\nchuckled till he cried.\n\nShaving was not an easy task, for his hand continued to\nshake very much; and shaving requires attention, even when\nyou don't dance while you are at it. But if he had cut the\nend of his nose off, he would have put a piece of\nsticking-plaister over it, and been quite satisfied.\n\nHe dressed himself \"all in his best,\" and at last got out\ninto the streets. The people were by this time pouring forth,\nas he had seen them with the Ghost of Christmas Present;\nand walking with his hands behind him, Scrooge regarded\nevery one with a delighted smile. He looked so irresistibly\npleasant, in a word, that three or four good-humoured fellows\nsaid, \"Good morning, sir! A merry Christmas to you!\"\nAnd Scrooge said often afterwards, that of all the blithe\nsounds he had ever heard, those were the blithest in his ears.\n\nHe had not gone far, when coming on towards him he\nbeheld the portly gentleman, who had walked into his\ncounting-house the day before, and said, \"Scrooge and Marley's, I\nbelieve?\"  It sent a pang across his heart to think how this\nold gentleman would look upon him when they met; but he\nknew what path lay straight before him, and he took it.\n\n\"My dear sir,\" said Scrooge, quickening his pace, and\ntaking the old gentleman by both his hands. \"How do you\ndo? I hope you succeeded yesterday. It was very kind of\nyou. A merry Christmas to you, sir!\"\n\n\"Mr. Scrooge?\"\n\n\"Yes,\" said Scrooge. \"That is my name, and I fear it\nmay not be pleasant to you. Allow me to ask your pardon.\nAnd will you have the goodness\"--here Scrooge whispered in\nhis ear.\n\n\"Lord bless me!\" cried the gentleman, as if his breath\nwere taken away. \"My dear Mr. Scrooge, are you serious?\"\n\n\"If you please,\" said Scrooge. \"Not a farthing less. A\ngreat many back-payments are included in it, I assure you.\nWill you do me that favour?\"\n\n\"My dear sir,\" said the other, shaking hands with him.\n\"I don't know what to say to such munifi--\"\n\n\"Don't say anything, please,\" retorted Scrooge. \"Come\nand see me. Will you come and see me?\"\n\n\"I will!\" cried the old gentleman. And it was clear he\nmeant to do it.\n\n\"Thank'ee,\" said Scrooge. \"I am much obliged to you.\nI thank you fifty times. Bless you!\"\n\nHe went to church, and walked about the streets, and\nwatched the people hurrying to and fro, and patted children\non the head, and questioned beggars, and looked down into\nthe kitchens of houses, and up to the windows, and found\nthat everything could yield him pleasure. He had never\ndreamed that any walk--that anything--could give him so\nmuch happiness. In the afternoon he turned his steps\ntowards his nephew's house.\n\nHe passed the door a dozen times, before he had the\ncourage to go up and knock. But he made a dash, and\ndid it:\n\n\"Is your master at home, my dear?\" said Scrooge to the\ngirl. Nice girl! Very.\n\n\"Yes, sir.\"\n\n\"Where is he, my love?\" said Scrooge.\n\n\"He's in the dining-room, sir, along with mistress. I'll\nshow you up-stairs, if you please.\"\n\n\"Thank'ee. He knows me,\" said Scrooge, with his hand\nalready on the dining-room lock. \"I'll go in here, my dear.\"\n\nHe turned it gently, and sidled his face in, round the door.\nThey were looking at the table (which was spread out in\ngreat array); for these young housekeepers are always nervous\non such points, and like to see that everything is right.\n\n\"Fred!\" said Scrooge.\n\nDear heart alive, how his niece by marriage started!\nScrooge had forgotten, for the moment, about her sitting\nin the corner with the footstool, or he wouldn't have done\nit, on any account.\n\n\"Why bless my soul!\" cried Fred, \"who's that?\"\n\n\"It's I. Your uncle Scrooge. I have come to dinner.\nWill you let me in, Fred?\"\n\nLet him in! It is a mercy he didn't shake his arm off.\nHe was at home in five minutes. Nothing could be heartier.\nHis niece looked just the same. So did Topper when he\ncame. So did the plump sister when she came. So did\nevery one when they came. Wonderful party, wonderful\ngames, wonderful unanimity, won-der-ful happiness!\n\nBut he was early at the office next morning. Oh, he was\nearly there. If he could only be there first, and catch Bob\nCratchit coming late! That was the thing he had set his\nheart upon.\n\nAnd he did it; yes, he did! The clock struck nine. No\nBob. A quarter past. No Bob. He was full eighteen\nminutes and a half behind his time. Scrooge sat with his\ndoor wide open, that he might see him come into the Tank.\n\nHis hat was off, before he opened the door; his comforter\ntoo. He was on his stool in a jiffy; driving away with his\npen, as if he were trying to overtake nine o'clock.\n\n\"Hallo!\" growled Scrooge, in his accustomed voice, as\nnear as he could feign it. \"What do you mean by coming\nhere at this time of day?\"\n\n\"I am very sorry, sir,\" said Bob. \"I am behind my time.\"\n\n\"You are?\" repeated Scrooge. \"Yes. I think you are.\nStep this way, sir, if you please.\"\n\n\"It's only once a year, sir,\" pleaded Bob, appearing from\nthe Tank. \"It shall not be repeated. I was making rather\nmerry yesterday, sir.\"\n\n\"Now, I'll tell you what, my friend,\" said Scrooge, \"I\nam not going to stand this sort of thing any longer. And\ntherefore,\" he continued, leaping from his stool, and giving\nBob such a dig in the waistcoat that he staggered back into\nthe Tank again; \"and therefore I am about to raise your\nsalary!\"\n\nBob trembled, and got a little nearer to the ruler. He\nhad a momentary idea of knocking Scrooge down with it,\nholding him, and calling to the people in the court for help\nand a strait-waistcoat.\n\n\"A merry Christmas, Bob!\" said Scrooge, with an earnestness\nthat could not be mistaken, as he clapped him on the\nback. \"A merrier Christmas, Bob, my good fellow, than I\nhave given you, for many a year! I'll raise your salary, and\nendeavour to assist your struggling family, and we will discuss\nyour affairs this very afternoon, over a Christmas bowl of\nsmoking bishop, Bob! Make up the fires, and buy another\ncoal-scuttle before you dot another i, Bob Cratchit!\"\n\n\nScrooge was better than his word. He did it all, and\ninfinitely more; and to Tiny Tim, who did NOT die, he was\na second father. He became as good a friend, as good a\nmaster, and as good a man, as the good old city knew, or\nany other good old city, town, or borough, in the good old\nworld. Some people laughed to see the alteration in him,\nbut he let them laugh, and little heeded them; for he was\nwise enough to know that nothing ever happened on this\nglobe, for good, at which some people did not have their fill\nof laughter in the outset; and knowing that such as these\nwould be blind anyway, he thought it quite as well that they\nshould wrinkle up their eyes in grins, as have the malady in\nless attractive forms. His own heart laughed: and that was\nquite enough for him.\n\nHe had no further intercourse with Spirits, but lived upon\nthe Total Abstinence Principle, ever afterwards; and it was\nalways said of him, that he knew how to keep Christmas\nwell, if any man alive possessed the knowledge. May that\nbe truly said of us, and all of us! And so, as Tiny Tim\nobserved, God bless Us, Every One!",
 "persons": {
  "65": "Charles Dickens",
  "636": "MARLEY",
  "829": "Scrooge",
  "463": "Marley",
  "936": "Marley",
  "852": "Scrooge",
  "2123": "Hamlet",
  "1411": "Scrooge",
  "2499": "Old Marley",
  "2684": "Scrooge",
  "1375": "Marley",
  "1482": "Scrooge ",
  "1544": "Scrooge",
  "5497": "Nature",
  "1688": "Scrooge",
  "6204": "God",
  "2473": "Scrooge",
  "2578": "Scrooge",
  "6392": "Humbug",
  "2620": "Scrooge",
  "2692": "Scrooge",
  "6263": "Scrooge",
  "6382": "Scrooge",
  "6483": "Scrooge",
  "6637": "Scrooge",
  "6703": "Scrooge",
  "11006": "Marley",
  "11113": "Mr",
  "6952": "Scrooge",
  "7537": "Scrooge",
  "7877": "Scrooge",
  "9330": "Scrooge",
  "12724": "Abundance",
  "7957": "Scrooge",
  "9093": "Scrooge",
  "9504": "Scrooge",
  "9562": "Scrooge",
  "9635": "Scrooge",
  "9884": "Scrooge",
  "9993": "Scrooge",
  "10272": "Scrooge",
  "10330": "Scrooge",
  "10523": "Scrooge",
  "10600": "Scrooge",
  "10776": "Scrooge",
  "11117": "Scrooge",
  "11189": "Scrooge",
  "11471": "Scrooge",
  "11583": "Scrooge",
  "11916": "Scrooge",
  "12032": "Scrooge",
  "12217": "Scrooge",
  "12370": "Scrooge",
  "12788": "Scrooge",
  "13409": "Scrooge",
  "12867": "Scrooge",
  "13224": "Scrooge",
  "13669": "Scrooge",
  "14054": "Scrooge",
  "15762": "Scrooge",
  "15921": "Scrooge",
  "16148": "Scrooge",
  "16357": "Scrooge",
  "16424": "Scrooge",
  "16960": "Scrooge ",
  "17346": "Scrooge",
  "17948": "Scrooge",
  "18410": "Scrooge",
  "18034": "Scrooge",
  "18502": "Scrooge",
  "18703": "Scrooge",
  "18743": "Marley",
  "18891": "Scrooge",
  "19038": "Marley",
  "19257": "Scrooge",
  "23234": "Humbug",
  "19642": "Scrooge",
  "20522": "Scrooge",
  "21082": "Scrooge",
  "22935": "Marley",
  "24626": "Ghost",
  "21290": "Scrooge",
  "21309": "Scrooge",
  "21376": "Scrooge",
  "21741": "Scrooge",
  "23248": "Scrooge",
  "24071": "Scrooge",
  "24378": "Scrooge",
  "24958": "Scrooge",
  "25103": "Scrooge",
  "26525": "Ghost",
  "26549": "Scrooge",
  "27583": "Ghost",
  "27737": "Scrooge",
  "27925": "Ghost",
  "27967": "Scrooge",
  "28002": "Ghost",
  "28046": "Scrooge",
  "28312": "Scrooge",
  "28567": "Scrooge",
  "28792": "Scrooge",
  "29358": "Scrooge",
  "33586": "Spirit",
  "28910": "Ghost",
  "29597": "Scrooge",
  "29443": "Ghost",
  "29663": "Ghost",
  "29858": "Scrooge",
  "30141": "Ghost",
  "30052": "Old",
  "30186": "Ebenezer",
  "30195": "Scrooge",
  "30698": "Ghost",
  "30837": "Scrooge",
  "30931": "Ghost",
  "30974": "Scrooge",
  "31125": "Scrooge",
  "31175": "Ghost",
  "31257": "Scrooge",
  "32033": "Scrooge",
  "32799": "Scrooge",
  "32105": "Ghost",
  "32927": "Ghost",
  "32976": "Scrooge",
  "33212": "Scrooge",
  "33512": "Scrooge",
  "33597": "Scrooge",
  "34891": "Marley",
  "33796": "Scrooge",
  "33645": "Ghost",
  "34011": "Scrooge",
  "33839": "Ghost",
  "34376": "Scrooge",
  "34809": "Scrooge",
  "34955": "Scrooge",
  "35323": "Scrooge",
  "35674": "Scrooge",
  "36319": "Ghost",
  "36257": "Scrooge",
  "36824": "Scrooge",
  "38677": "Ghost",
  "37544": "Scrooge",
  "38311": "Scrooge",
  "38433": "Scrooge",
  "38958": "Scrooge",
  "42077": "Spirit",
  "39523": "Scrooge",
  "42318": "Ghost",
  "42552": "Spirit",
  "42327": "Christmas",
  "42624": "Ghost",
  "42367": "Scrooge",
  "42439": "Scrooge",
  "42844": "Scrooge",
  "43079": "Scrooge",
  "43460": "Scrooge",
  "43225": "Spirit",
  "43917": "Scrooge",
  "44411": "Scrooge",
  "44911": "Scrooge",
  "45108": "Scrooge",
  "45275": "Scrooge",
  "45895": "Scrooge",
  "46237": "Scrooge",
  "46428": "Scrooge",
  "47310": "Scrooge",
  "47300": "Ghost",
  "47562": "Scrooge",
  "50122": "Ghost",
  "47987": "Scrooge",
  "52427": "best",
  "48365": "Scrooge",
  "48067": "Spirit",
  "49952": "Spirit",
  "49977": "Scrooge",
  "50223": "Scrooge",
  "53412": "Spirit",
  "54062": "Ghost ",
  "54115": "Scrooge",
  "54155": "Scrooge",
  "54372": "Scrooge",
  "54947": "Ghost",
  "54798": "Scrooge",
  "54932": "Scrooge",
  "59839": "Scrooge",
  "60177": "Ghost",
  "60390": "Scrooge",
  "60404": "Spirit",
  "60710": "Scrooge",
  "60400": "The",
  "61226": "Ghost",
  "61261": "Scrooge",
  "61325": "Scrooge",
  "61497": "Scrooge",
  "61598": "Spirit",
  "61642": "Scrooge",
  "61731": "Scrooge",
  "65230": "Scrooge",
  "65368": "Scrooge",
  "65449": "Ghost",
  "65703": "Scrooge",
  "69387": "Spirit",
  "69529": "Ghost",
  "65897": "Scrooge",
  "69638": "He",
  "68512": "Scrooge",
  "69121": "Scrooge",
  "69137": "Scrooge",
  "69401": "Scrooge",
  "70230": "Spirit",
  "69598": "Scrooge",
  "69657": "Ghost",
  "70023": "Scrooge",
  "75952": "Phantom",
  "74982": "Scrooge",
  "75772": "Scrooge",
  "75991": "Scrooge",
  "76157": "Scrooge",
  "76102": "Ghost",
  "76180": "Christmas Present",
  "76220": "Scrooge ",
  "76435": "Scrooge"
 },
 "locations": {
  "10741": "Bedlam",
  "39250": "Heaven"
 },
 "organisations": {
  "2578": "Scrooge and Marley"
 },
 "misc": {
  "36": "Ghost Story of Christmas",
  "120": "Ghostly",
  "506": "Three Spirits Stave",
  "531": "The Second of the Three Spirits Stave",
  "574": "The Last of the Spirits Stave",
  "609": "The End of It",
  "1296": "Country",
  "6392": "Humbug",
  "3452": "Christmas",
  "12158": "Treadmill",
  "12176": "Poor Law",
  "14071": "Gothic",
  "10160": "Christmas",
  "30698": "Ghost",
  "46129": "Christmas",
  "55108": "Christmas",
  "60823": "Spirit",
  "74928": "Christmas",
  "74957": "Spirit"
 }
}